titles,category
 학문의 자유  앞세운  위안부 매춘의 일종  발언 무죄 정의연  일본 재판부인가 ,Social
 강남 마약음료  주범 구속기소    검찰  최고  사형  혐의 적용,Social
  현대중공업  울산해수청 상대  방파제 공사비  소송 승소    억 상당,Social
 나 잡아봐라  마약 취해 집안 이리저리 뛰어다닌 남성 검거,Social
 자책말라  판사가     억 전세사기  피해자들에게 건넨 위로,Social
인천 자월도 주차된 차량서 남녀  명 숨진 채 발견 경찰 수사,Social
대구서 경주까지     역주행한 택시 이 사람들이 막았다  대체 무슨 일 ,Social
구글  운영체제 갑질   천억 과징금 불복 소송 패소,Social
 천여명이 버린 일회용 플라스틱 보니     가 식품포장재 ,Social
 손 아프니까 오렌지 좀 까줘  갈비탕집 등장한  진상  손님,Social
 머리카락 나왔다  비싼 초밥만 쏙쏙 골라먹고 환불 요청한 손님,Social
서울고법    대한통운  택배노조와 교섭해야  재차 판단,Social
새벽 고속도      역주행한 택시  트래픽 브레이크 로 막은 경찰,Social
   억 전세사기 재판 중  자책 말라  피해 청년들 위로한 판사,Social
대구 경주     역주행한  택시  이것 만나 멈췄다,Social
 팬데믹    대 여성 셋 중 하나 자살충동  남성  배 왜 ,Social
미국      김건희 리스크  정조준      달러 디올백  한국 여당 뒤흔들어 ,Social
정부    인 미만 중대재해법  고용 악영향  노동계  공포 조장  종합 ,Social
경부고속도로 역주행 한 택시  손님  반대방향  말에 핸들 돌렸다,Social
민폐주차 차량 지붕에 주차금지 입간판 올려둔 남자    법원서 벌금형 ,Social
 영상  손님 태우고 고속도로서     역주행한 택시,Social
윤재성 김윤미 부부 일곱째 자녀 출산  화제 ,Social
 대표님 환영합니다   이재명   어린이집 시찰,Social
유퀴즈 나온 국민참여재판 전문검사   호 공판 블랙벨트 인증,Social
     폭설  광주 전남 하늘길 뱃길 재개 대설특보 해제 종합 ,Social
흉기 들고 지구대서 난동 부린   대   무술   단  유단자 경찰이 제압,Social
출소  년 만에 성폭행   대 항소심 중형,Social
 설 명절에는 아버지 장례 치를 수 있길       일째 싸우는 분신 택시기사 유족,Social
  보  택배노조 교섭 거부한   대한통운  심도  부당노동행위 ,Social
부산 북구청장 막말 논란에 장애인 단체  인식 변화 계기 돼야 ,Social
 자막뉴스  화분에 손 넣어봤더니  헉    엄청난 눈 쏟아진 서해안 상황,Social
   서울 강서구 전세 사기범  징역   년형에 항소,Social
정유라  소개팅서 햄버거 나눠 먹은 김남국 추잡해 ,Social
김해판  서울 둔촌주공  될까   외동 주공 조합원  노심초사 ,Social
 얼굴 물려   바늘 꿰맸다  부산시민들 공포 떨게한 들개  마리,Social
전국 인문대학 학장들   무전공 모집  중단해야 인기학과 쏠림 심화할 것 ,Social
 저 여자 술취했다  남친 말에 출동 안한 경찰  납치됐다  고속도로 뛰어든   사망,Social
계속된 한파에 한강도  꽁꽁   현장 화보 ,Social
  대한통운  택배 노조 교섭 거부    심도 부당노동행위 인정,Social
 속보   안드로이드 탑재  강요로  천억대 과징금 구글 불복했지만 패소,Social
 음대 입시 비리 의혹     경찰  경희대 압수수색,Social
충남 서천 수산물특화시장 화재현장   차 합동감식 ,Social
 반대 방향 이란 손님 말에  새벽 고속도로서     역주행한 택시,Social
얼굴 절반 뒤덮은 종양 탓 은둔 생활한     대 엄마   서 미소 되찾아,Social
주차장 통로에 상습 주차한 입주민  열받아 차량에 주차금지 표지판 올렸더니,Social
경부고속도로에서     역주행한 택시 이유 물어보니,Social
 국기연 부서 대전 이전  반대  진주 예비후보들   인 시위,Social
십여년 만의 고백  저 술 못 먹어요 ,Social
제주공항 운항 재개   해안지역 눈발 약해져,Social
 대학교수가 입시생 불법 과외      경희대 압수수색,Social
 자책 마시라     억 전세 피해 사회초년생들 울린 판결문,Social
지구대에서 흉기 난동   무술   단 경찰이 제압  영상 ,Social
음주 무면허 운전 적발 공무원   또  만취 운전,Social
    탑재 강요  구글   천억대 공정위 과징금 취소소송 패소,Social
 원래 이렇게 만져요    힘 확인한 것     중 성추행 공방 일었다,Social
홍준표  권영진 전 시장 비판  주민 우롱 말고 정정당당하게 선거 ,Social
 속보  심 법원도  택배노조 교섭 거부한   대한통운  부당노동행위 ,Social
서울고법  공정위  최태원   실트론 지분 인수에 대한 과징금 취소 ,Social
 위안부 매춘 발언  류석춘   심서 무죄,Social
전 부인 차에 태워 대구 경남까지 끌고 간   대 체포,Social
 음대 입시 비리 의혹     경찰  경희대 압수수색,Social
충남 서천 수산물특화시장 화재현장   차 합동감식 ,Social
 반대 방향 이란 손님 말에  새벽 고속도로서     역주행한 택시,Social
얼굴 절반 뒤덮은 종양 탓 은둔 생활한     대 엄마   서 미소 되찾아,Social
주차장 통로에 상습 주차한 입주민  열받아 차량에 주차금지 표지판 올렸더니,Social
경부고속도로에서     역주행한 택시 이유 물어보니,Social
 국기연 부서 대전 이전  반대  진주 예비후보들   인 시위,Social
십여년 만의 고백  저 술 못 먹어요 ,Social
제주공항 운항 재개   해안지역 눈발 약해져,Social
 대학교수가 입시생 불법 과외      경희대 압수수색,Social
 자책 마시라     억 전세 피해 사회초년생들 울린 판결문,Social
지구대에서 흉기 난동   무술   단 경찰이 제압  영상 ,Social
음주 무면허 운전 적발 공무원   또  만취 운전,Social
    탑재 강요  구글   천억대 공정위 과징금 취소소송 패소,Social
 원래 이렇게 만져요    힘 확인한 것     중 성추행 공방 일었다,Social
홍준표  권영진 전 시장 비판  주민 우롱 말고 정정당당하게 선거 ,Social
 속보  심 법원도  택배노조 교섭 거부한   대한통운  부당노동행위 ,Social
서울고법  공정위  최태원   실트론 지분 인수에 대한 과징금 취소 ,Social
 위안부 매춘 발언  류석춘   심서 무죄,Social
전 부인 차에 태워 대구 경남까지 끌고 간   대 체포,Social
 롤스로이스    심 징역   년 피해자 측  검찰 구형 아쉬워 ,Social
 롤스로이스 사망 사건  운전자 징역   년  증거 인멸 급급 ,Social
  조원 기부왕  회사의 몰락 전직원    명 해고 통보,Social
 사이다 판결  살인 전과 성폭행범  징역      년으로 늘어,Social
자동차정비 기사  전기차 배우면  국가기술자격증 에 반영,Social
 미분양 무덤  대구 후분양 단지    뒤늦은 분양  골머리 ,Social
 무전공 확대 정책 에 전국 인문대 학장 모였다  기초학문 붕괴 ,Social
김우호  정부 인사혁신처장   시간 만에 귀가   검찰에 성실히 답변 ,Social
부지 사업비 문턱 넘은 양산문화예술의 전당 건립  최대 고비 맞았다,Social
서류 허위발급하고 취업사실 숨긴 채 실업급여 타낸 일당 적발,Social
 기초학문 붕괴  전국 인문대학장  무전공 모집 추진에 반발,Social
미숙아 강제 출산 방치   층서 던진 비정한 친모들 첫 재판,Social
대구서 경주까지 한밤 중 경부고속도로     역주행한 택시,Social
퇴사한 것처럼 속여  실업급여   직원과 사업주 등  명 적발,Social
 외도의심  아파트 노상서 아내 살해   대 징역   년에 검찰 항소,Social
대구서 경주까지 고속도로     역주행한 택시 경찰 화물차 기사가 막아,Social
국힘 이택구 대전 서구을 예비후보  둔산지구 재건축 재개발 물꼬 ,Social
김태흠 지사  대통령께 지원내용 전달 마음 풀어달라  사과,Social
전 현직 대구시장  페이스북에서 설전,Social
      폄훼  논란 인천시의장 불신임안 가결 의장직 상실,Social
살인죄 출소 후   대  성폭행한   대  심서  가중처벌 ,Social
 내가 기소한 사건 구형 줄여줄게    출신 변호사  심 실형,Social
곗돈 돌려막기 후  먹튀 한   대 여성 피해 금액만 무려  억,Social
 발달장애는 죄가 아니다  국힘 구청장에게 울분 토한 부모들,Social
 뉴스    어  이 방향 아닌데     고속도로      역주행한 택시,Social
살인죄로  징역   년  산   대  출소  년 만에   대 성폭행,Social
파란 페인트로 쓴  바다남   액운 막으려고 ,Social
 반대 방향  승객 말에 고속도로서 유턴  공포의 역주행 ,Social
  대 살인전과자    대 이웃 성폭행 형량 늘어 징역   년,Social
지역주택조합  복마전  청주시  실태조사 후 수사의뢰,Social
수도권 대형병원   개  올해부터 간호사 채용면접 동시 진행하는 이유,Social
 허위 초청  외국인 무더기 입국 도운 무역업자 추가 기소서 징역형,Social
말싸움 중 아내 살해한   대 징역   년에 검찰 항소,Social
김남국  햄버거집에서 소개팅  반씩 나눠먹었다  호소,Social
안산 제조공장서   대 근로자 금형기계에 끼여 숨져,Social
울산 대왕암 바위에 낙서한   대 검거  가족 액운 막으려고 ,Social
   중국서 송환된  강남 마약음료  주범 구속기소,Social
롤스로이스  에게 마약 처방하고 환자 성폭행   대 의사 구속기소,Social
정준영  월 출소 단톡방 멤버들  복귀 움직임,Social
 우리 애 당뇨 걸리니 제로로 줘요  개업 주년 서비스에 호통친 고객,Social
     억원 유사수신     억원 투자금 편취   아도  상위모집책 구속기소,Social
경찰   지하철 탑승 시위  전장연 활동가 구속영장,Social
 나 잡아봐라  피 흘리며 뛰어다니던 알몸   경찰이 체포하니,Social
 지하철 탑승 시위  전장연 활동가에 구속영장 신청  사사건건 ,Social
 내 엉덩이 꽉 움켜쥐고 주무른 헬스트레이너  왜 무혐의입니까 ,Social
  월 출생아 또  역대 최저    개월째 줄어든 대한민국,Social
 자책말라  판사 말에 울음 터졌다    억 전세사기 재판장서 생긴 일,Social
음대 교수 입시비리 불법 과외 의혹 경찰  경희대 압수수색,Social
 볼 터지겠네   연차 낼까  강추위에 대구시민들 발동동,Social
 학교 멀어 통학 힘들어요   제주도  올해안에 남중 여중 각  개교  남녀공학  추진,Social
광주시 올 하반기 승진 풍년에 활력,Social
 백윤식이 합의서 위조  거짓 주장   연인 무고 혐의로 기소,Social
새벽 경부고속도로     역주행한 택시,Social
   일 이태원 참사 특별법 공포 촉구에 동참해달라 ,Social
벙커 유   억 원어치 훔쳐 내다판 일당 검거,Social
 차로에서  차로로 시속      주행한 유튜버  갑론을박   지금이뉴스 ,Social
국정원   공공분야 해킹    는   소행  총선 개입 공작 우려 ,Social
말다툼하다 흉기로 아내 살해   대 검찰  징역   년 부당  항소,Social
 출소 일주일 만에 또  벽돌 든   대 편의점 강도 항소심도 징역  년,Social
겨울왕국으로 변신하는 태백 태백산 눈축제   일 개막,Social
 구형 줄여주겠다 며 돈 받은 검사 출신 변호사 실형,Social
        녹말 이쑤시개 튀김  영상 유행에 식약처 긴급 경고,Social
 집 가는데 돈 내  중구 용산구 주민  남산터널 통행료  면제 검토,Social
원주서 제조된  강남 마약음료  제조책 구속 기소 중국서 송환,Social
 현장컷   즉각  강력하게  끝까지 응징  해병대 평창서 영하   도 혹한 속 훈련,Social
     억대 유사수신  아도인터내셔널 대표 추가 기소,Social
나주 공동혁신도시서 무자본 갭투자로   세대 전세사기   대 구속,Social
 하급자 돈 모아 과장 밥 사줘   모시는 날  신고에 부산 경찰 발칵,Social
 롤스로이스  마약처방  의사   환자   명 성폭행 혐의도 구속기소,Social
신원식 전주갑 예비후보  민주당 탈당  이낙연 신당 등 검토 ,Social
고속도로     역주행 택시    이것 으로 사고 막아,Social
보이스피싱 전달책  국가 상대 소송  압수한 돈 돌려달라  결국  패소 ,Social
 위안부는 자발적 매춘  류석춘  교수  피해자 명예훼손 무죄,Social
노동부 익산지청  실업급여 부정수급자   명 적발,Social
고속도로     공포의 역주행 경찰차 화물차 합동 작전에 멈췄다,Social
   억 손실에도    억 기부 그 회사 결국 전 직원 해고했다,Social
문충운 예비후보   포항 연일에 한국형 실리콘밸리 조성하겠다 ,Social
정박해 있는 배에서 기름   억원어치 빼돌린 일당 적발,Social
 울산 대왕암 바다에 거대 불상을   기독교연합회 반발,Social
안산 플라스틱 제품공장서   대 노동자 끼임 사고로 숨져,Social
  대 이웃 성폭행한 살인 전과자   심서 형량 늘어 징역   년,Social
광주 전남 전 지역 대설주의보 해제,Social
 구형 줄여줄게  돈 챙긴 전직 검사 실형,Social
흉기 목에 대고 협박한   대     단 유단자  경찰이 맨손 제압한 순간,Social
검찰  중국서 송환된  강남 마약 음료  제조책 구속 기소,Social
경찰  경희대 입학처 압수수색  음대 교수들 불법 과외 입시 비리 의혹,Social
 강원     문화를 만나다  문화도시 강릉의 매력 전 세계에 알릴 것 ,Social
 학원가 마약 음료  주범인   대 남성 구속 기소,Social
부산    억 전세 사기   대 징역   년 판사는  탐욕 제어 못 한 시스템 탓  피해자는 잘못 없다  위로,Social
     폭설  광주 전남 대설특보 사흘 만에 모두 해제,Social
      폄훼 불신임안 상정 거부  허식 인천시의장  결국 권한 박탈,Social
 롤스로이스남 마약 처방  의사 구속 기소 환자 성폭행 혐의도,Social
금오공대 교수     세계 상위    연구자  선정,Social
올해 설 차례상 비용은 전통시장    만원   대형마트   만원 ,Social
인천 자월도 주차된 차량서 남녀  명 숨진 채 발견,Social
 압구정 롤스로이스남 에 마약류 불법 처방한 의사 구속기소,Social
놀라운    튜터  제자들  이건 카타르시스를 못 줘요 ,Social
출생아 수 또  역대 최저치     줄어  만     명,Social
 교수 불법과외 의혹  경희대 음대 압수수색,Social
  대 공익근무요원 근무지서 극단 선택 경찰 수사,Social
광주시  광역철도 협의 안 하면 예타중지  전남도 압박,Social
 해직교사 부당채용  조희연 대법 간다  징역형 집유  불복 상고,Social
음대 입시비리 전방위 확대 불법과외 의혹 경희대  압색 ,Social
울산 기독교계  대왕암공원 불상 건립 계획 철회해야 ,Social
수상한 남편의 한밤 외출  카톡 보니 아파트 동대표와 여행까지,Social
 풍경  북극 한파에 충북 단양강  꽁꽁 ,Social
김영록 전남지사  민주당으로 단합해야 분열 바람직하지 않아 ,Social
 압구정 롤스로이스 사고  가해자  심 징역   년    의사 만류에도 운전 ,Social
한 교육학자의 일침  교육부인가  에듀테크 기업부인가  ,Social
아시아나항공  밀린 기내식 대금    억 지급 확정,Social
 원심력이 뭔지 알려줘     수강생 던진 강사  항소심도 집행유예,Social
 위안부 매춘  류석춘   년만에 무죄 정대협  반인권적 판결 ,Social
음주 무면허  차례 처벌받은 공무원  또 음주운전 적발,Social
국민의힘 강수현 양주시장  돈봉투 살포 혐의로 불구속 송치,Social
    롤스로이스  마약 처방  의사 구속기소,Social
양구 대표 겨울축제 생기나개최 위해 타 시 도 축제 벤치마킹,Social
육지보다 비싼 배송비   인천시  섬 주민에   최대   만원 지원,Social
부산 한복판에 들개 출몰  시민 얼굴 물려   바늘 꿰맸다 ,Social
 단독  김상조 이호승  부동산원  통계 유출 그만  요청 묵살      관련 진술 확보,Social
고속도로      역주행  공포의 택시  경찰에 붙잡힌 기사  황당  해명,Social
전국 땅값       상승 세종      로 가장 많이 올라,Social
 코로나   예방접종  효과 있었다    질병청   중증화 예방효과  확인,Social
고양시 원혜진 주무관 열정 뿜뿜  고양    새 얼굴,Social
촬영 위해 일부러 말 넘어뜨려 죽게 한 태종 이방원 제작진  법원에 항소,Social
롤스로이스 가해 남성에게 마약 불법 처방한 의사 구속기소,Social
 기름   억  훔친 도둑들 잠복 근무에 딱 걸렸다,Social
미세먼지 주범 황 기준치   배 해상유   억원치 유통 일당 적발,Social
  현대중공업  방파제 복구비용 보전소송 승소,Social
경찰   음대 교수 입시 비리 의혹  경희대 압수수색,Social
음대 교수가 입시생  불법 과외   경희대 압수수색,Social
세종시 대중교통 이용객  쑥쑥     월 시행  이응패스   통합환승  주목,Social
 버닝썬  승리   뜬금 허세     중국풍 일본풍 그림 올린   재외공관   프레스룸               ,Social
     갈등  봉합   김경율 거취 김 여사 사과  등 갈등 불씨는 아직  프레스룸     이슈    ,Social
정쟁 떠난 대구 수성갑 여 야 예비후보들의 출근길 인사,Social
 액운 털어내려고  울산 대왕암공원  바다남  낙서   대 검거,Social
   같이 타고 가자     자리 있습니까  갈등 이틀만에  봉합 열차    프레스룸     이슈    ,Social
 포병여단 흑곰대대 군인아저씨는 우리 선생님  교육봉사활동 화제,Social
 주차된 차에 사람 쓰러져 있다  인천서 남녀  명 숨진 채 발견,Social
 위기의 부경동물원  잔여동물 구제책 마련한다,Social
 선처해달라   신생아  숨지게 한 친엄마들 첫 재판서 눈물의 호소,Social
류석춘  위안부 매춘  발언 무죄   법원 판결의 긴 서술어,Social
   도 인사   어깨 툭      서천 현장 동행    국민 배경  정치쇼    프레스룸     이슈    ,Social
검찰   롤스로이스  마약 처방  의사 구속기소 환자 성폭행 혐의도,Social
롤스로이스 에 마약 처방 의사  환자 성폭행 혐의 구속기소,Social
    국민 눈물 거부한 비정한 대통령으로 기억될 것인가  이태원 참사 ,Social
 경찰 앞에서 무아지경  집에서 나체로 피흘린    옆집서 신고했더니 체포 왜 ,Social
제주 해안 대설특보 모두 해제 하늘길 뱃길 정상화 수순 종합 ,Social
    갈등 봉합 수순      대학생   군장병 행보   항공기    여 편 결항  프레스룸     앵커브리핑 ,Social
 이시각헤드라인   월   일 뉴스센터  ,Social
      폄훼  허식  인천시의장직 박탈  혼미할 정도로 힘들다 ,Social
출생아  개월째  만 명대 작년     월   만  천 명 역대 최소,Social
 서천특화시장 화재  원인은 합동 감식 돌입,Social
이런 차만 털렸다     만원어치 금품 훔친   대 구속,Social
 따뜻한 한 끼 나눠요  추위 잊은 따뜻한 온정,Social
 지난해  월부터 미분양관리지역인데   포항서     가구 분양,Social
민폐 주차 차량 지붕에 주차금지 입간판 올렸다가 벌금형 항소심  원심 깨고 무죄판결,Social
  인미만 중대재해법     정부  준비할 기회달라  마지막 호소,Social
학원가  마약음료 사건  주범  국내 송환 한 달 만에 구속기소,Social
지구대 찾아와 흉기 휘두른   대  무술   단 경찰이 제압,Social
대구서 경주까지 경부고속도로     역주행한 택시,Social
정무 비서 지낸 전희경  의정부  갑  출사표,Social
인천 자월도 해안가 차량서 남녀  명 숨진 채 발견,Social
청년근로자 월   만원 저축하면  년 후   천만원    받는다,Social
서울 강남구서 첫째 낳으면 누구나 첫 달  최대    만원 ,Social
 전재산     억원 사회 환원  닭강정 노점상 출신 기업인,Social
  대 이웃 성폭행한 살인 전과자   심서 형량 늘어  징역   년 ,Social
서울 강남구에서 첫째 낳으면 첫 달    만원 보따리 푸는 자치구,Social
    일째 장례 못치른  분신 택시노동자  대표 엄벌하라 ,Social
 인구 블랙홀 경기도    년 새    만명 증가  천   만명,Social
지구대서 흉기 난동부린   대  무술   단  경찰이 제압,Social
 장애아 낳은 게 잘못  망언 오태원 부산 북구청장  공개 사과,Social
도로망 개선 나서는 고양시  출퇴근 시간 획기적으로 줄입니다 ,Social
중처법    인 미만  확대      적용유예 논의 중단하라 ,Social
 친절한 뉴스    산업스파이 꼼짝마   처벌 강화한다,Social
  천억대 유사수신  아도인터내셔널 대표 모집책 기소,Social
경찰  교수 불법과외 의혹 경희대 음대 압수수색 종합 ,Social
 으아아악  피 흘리며 알몸으로 발작하는 남성  경찰이 잡고 보니,Social
노동부 장관  빵집 사장도 대상  중대재해법 유예 호소 민주노총  더 이상 안돼 ,Social
 이경규 장도연 출연료 미지급  기획사 대표  이번엔 횡령 혐의로 유죄  사사건건 ,Social
수도권 대형병원   곳이 같은 날 간호사 뽑는 이유는,Social
음료 무료 서비스 줬더니  애 당뇨 걸려  제로 없어   고함 친 진상 손님,Social
경찰   지하철 탑승 시위  전장연 활동가에 구속영장 신청,Social
  억원대 선박 연료 빼돌려 불법 유통한   명 검거,Social
사망 사고 낸 롤스로이스 에 마약 처방한 의사 구속기소,Social
   억 전세사기   대 징역 중형 청년들 마음 어루만진 판결문 눈길,Social
  대 택시기사 고속도로      역주행  트레픽 브레이크 로 사고 막았다,Social
부산 청년들 울린    억대 전세사기   대   징역   년,Social
검찰  롤스로이스 운전자 마약 처방 의사 구속기소,Social
백미러 안 접힌 차량만 노려     만원 훔친   대 구속,Social
사이다 서비스 줬더니  애 당뇨 걸리니 제로로  할 거면 제대로 해 ,Social
 대왕암 앞에 거대 불상 건립 말라  기독교단체 반발,Social
부산서    억원 전세 사기   대  심서 징역   년 선고,Social
교육부   음대 교수 입시비리 의혹  경희대 현장조사,Social
 롤스로이스 사망 사건  운전자 징역   년 선고,Social
출산율 뚝뚝 떨어져도 강남구  나홀로 증가 ,Social
 위안부 발언  류석춘 무죄 정대협 명예훼손은 벌금형,Social
서울 은평구 아파트 화재 주민   여 명 대피,Social
 압구정 롤스로이스  가해자 징역   년 선고,Social
 월 총선 여야 공천심사 앞두고 경기지역 과열 혼탁 양상,Social
수리 중 움직인 엘리베이터   대 작업자 추락사,Social
 주유 덜 해서 빼돌려  해상유    만 리터 불법 유통한 일당 체포,Social
주식 사놓고 셀프 추천한 애널리스트 징역  년 개월에 항소,Social
 롤스로이스 뺑소니  가해자 징역   년  중형 선고 필요 ,Social
음주운전   대 러시아인  가로등 들이받아 차량 전소,Social
한파 계속 제주 내일까지 많은 눈,Social
 자막뉴스  기름 옮기다가 유유히   외항선 등 쳐먹은 방법,Social
대설특보 해제 빙판길 사고 잇따라,Social
대설 한파에 결항 동파 속출 제주공항 재개,Social
회사 망하는 줄 모르고   퍼주다  전직원 해고통보 한 업체,Social
해상유    만  몰래 빼돌려   고유가 속   억 챙겨,Social
사흘째 계속되는 한파 수도계량기    건 동파,Social
흉기 들고 지구대서 난동 부린   대   유단자 경찰 이 제압,Social
 위안부  매춘의 일종  류석춘  심 무죄 선고,Social
 강남 마약 음료    대 주범 구속 기소 미성년자 마약 투약 혐의,Social
 단독  간첩 잡는다며    년된 보안망 쓰는 경찰 안보수사단,Social
 직원 채용 시 학력차별 말라  인권위 권고  연세대만 불수용,Social
충남 서천 수산물특화시장 화재현장   차 합동감식 ,Social
수도권 상급종합병원   월부터 신규간호사 동시에 최종면접,Social
직장내괴롭힘 신고인이  가해자  근무장소 바꿔달라는데 ,Social
   병원 스토리 수도권 상급종합병원 신규 간호사 최종 면접 같은 기간 시행,Social
성희롱 신고라고 성희롱만 따져보고 사건 종결했다가는 ,Social
임금체계 개편  단 하나의 정답은 없다 ,Social
외항선  해상유  몰래 슬쩍   억 원어치 빼돌린 일당 검거,Social
평택항 해상유   억원치 빼돌린 일당   명 검거,Social
 육아휴직 복귀했더니 승진 누락됐네요 ,Social
분신 택시기사 대책위  반성없는 회사 대표 엄벌을 ,Social
인권위  직원 채용 시 학력차별 개선 권고 연세대 거부,Social
