titles,category
 집안 남자들 좋은 기운 받게 하려고   울산 대왕암공원 낙서범의 해명,Social
 아아악   알몸으로 뛰어다닌 남성  제압하고 보니   ,Social
 액운 막으려  울산 대왕암공원 낙서범 검거,Social
 속보   위안부는 자발적 매춘  류석춘   심 벌금    만원 선고,Social
이경규 장도연 등에 출연료 안 준 기획사 대표  횡령 혐의 집유,Social
    원만      년째 지속된  온라인 구걸 에 누리꾼 눈살,Social
 콘서트 티켓 싸게 팔아요      만원  먹튀 한   대  징역  년,Social
      왜곡 신문 배포  허식 인천시의장직 상실 불신임안 가결 종합 ,Social
부산 북항재개발지역 관통  이순신대로    일 개통,Social
밀양서 차량 글램핑장 화재 잇따라  명 숨져,Social
 고발 사주  제보자 조성은  입당원서 조작 혐의로 재판행,Social
    원만      년째 지속된  온라인 구걸 에 누리꾼 눈살,Social
 콘서트 티켓 싸게 팔아요      만원  먹튀 한   대  징역  년,Social
      왜곡 신문 배포  허식 인천시의장직 상실 불신임안 가결 종합 ,Social
밀양서 차량 글램핑장 화재 잇따라  명 숨져,Social
부산 북항재개발지역 관통  이순신대로    일 개통,Social
 고발 사주  제보자 조성은  입당원서 조작 혐의로 재판행,Social
 속보   위안부는 자발적 매춘  류석춘 교수  심서 무죄,Social
 만    여명 발 묶인 제주공항    일 항공편 재개,Social
 최대       폭설  광주 전남 빙판길 교통사고도  속출  종합 ,Social
아들 가방에  몰래 녹음기  넣은 주호민 부부  아동학대 로 신고당했다,Social
롤스로이스    심   년형  반성않고 증거인멸 급급  상보 ,Social
유세윤 장도연 출연료 안 준 기획사 대표     억대 횡령 혐의 징역형,Social
 압구정 롤스로이스 사망 사고  가해자  심 징역   년,Social
겨울잠 자고    만 원 받는다 시몬스 이색 알바   만 명 몰려,Social
 롤스로이스 인도 돌진  가해자 징역   년 선고,Social
 역무원 시절부터   년 준비   지하철   분 재승차 제안  임국현 서울시 팀장 스 우 파 ,Social
 압구정 롤스로이스  인도 돌진   대   심 징역   년,Social
역사적 상징물에    자가    서울 울산에 이어 제주도 낙서 테러,Social
 압구정 롤스로이스 사고  운전자   심서 징역   년,Social
 그 때 참 힘들었지    대  남성보다 자살 충동  배 더 컸던 시기,Social
역사적 상징물에    자가    서울 울산에 이어 제주도 낙서 테러,Social
 압구정 롤스로이스 사고  운전자   심서 징역   년,Social
 그 때 참 힘들었지    대  남성보다 자살 충동  배 더 컸던 시기,Social
비행기 떴다 기상악화 풀린 제주공항 항공기 운항 정상화,Social
루이비통  샤넬  짝퉁 명품 에 발암 물질  범벅 ,Social
    중 엉덩이 움켜쥐었다  트레이너 성추행 신고했지만  무혐의 ,Social
  기업까지 뛰어든 가정용 심전계 시장 최후 승자는 ,Social
담임에 노출 여성 합성한 학생들 교권 피해 신고에  아동학대  보복 ,Social
제주  성급 리조트 더 시에나   박에  박 더  프로모션,Social
 미분양 무덤  대구서 주택사업승인 반납 사례 발생,Social
 속보   압구정 마약 롤스로이스 운전자   심 징역   년,Social
셀트리온    우시   와     신약 개발 공동 개발,Social
 도주치사 혐의  롤스로이스   심 징역   년    죄책 중해   보 ,Social
 속보  압구정 롤스로이스남   심 징역   년,Social
 담임  성적 수치심 느껴  신고했지만  아동학대 로 역신고 당했다,Social
하루 식사시간     분    대만 간호사들의 폭로,Social
이경규 장도연 출연료 미지급 기획사 대표  횡령혐의 집유,Social
 민폐주차  차량 위에  주차금지  입간판 올린   대  항소심서  무죄 ,Social
 남녀 속옷 에 꼬리 잡혔다 기암괴석  바다남  낙서범 검거,Social
인천 영종도  한국판 라스베이거스 로 변신   국내 최대 카지노 승인,Social
 남녀 속옷 에 꼬리 잡혔다 기암괴석  바다남  낙서범 검거,Social
  인당  주일 일회용 플라스틱   개 사용 폐기물  생수 음료  최다 ,Social
주호민 부부   아동학대 로 신고당해  아들 방임  주장한 특수교육전문가,Social
 신호 위반 차에 치여 다리 절단 가해자는 사과 한마디 없네요 ,Social
 먼 곳 자식보다 이웃사촌  경남형 통합돌봄 확대한다,Social
 압구정 롤스로이스 뺑소니  운전자   심서 징역   년,Social
스키 시즌 대목인데 춘천 대형 스키대여점 화재로 전소,Social
 경찰이 압수한 돈 돌려달라  국가에 소송 건 보이스피싱 가담자 패소,Social
적자    억에 직원 월급도 밀릴 뻔 제주대병원 무슨 일 ,Social
 피해자 보고 웃어     압구정 롤스로이스  가해자 징역   년,Social
 안전운전만 할꺼다  올림픽대로서 시속     로  길막 하던 유튜버,Social
이경규 장도연  억대 출연료  못 받았다 기획사 대표  징역형 집유,Social
제주도 폭설 강풍 사흘째 하늘 바닷길에 결항 이어져,Social
학교 운동부 예산  천만원 횡령한 교사 징역형 집행유예,Social
울산 대왕암공원  바다 남  낙서범 검거   액운 쫓으려고 ,Social
 속보   압구정 롤스로이스    심 징역   년 선고,Social
 이경규 등 출연료 미지급  기획사 대표 횡령 혐의 집유,Social
 손톱 망가지니 오렌지 좀 까줘  식당 알바생 부르더니 황당 요구,Social
무면허 음주 적발되자 친언니 주민번호 댄   대 징역형,Social
수리 중 갑자기 움직인 엘리베이터 평택 공사장서   대 추락사,Social
 난   와 각별   조원 수표도 하사했다  거짓말로  억원 가로챈   대 ,Social
 매진된 콘서트표 팝니다  표 안 보내고     만원  꿀꺽    대 결국,Social
 중처법      제조 건설업  기어코 강행   카페에선  공장만 적용 아녜요  ,Social
나주혁신도시 오피스텔    채로 갭투자 전세 사기,Social
올림픽대로에서 시속     로 운전  민폐냐 아니냐  갑론을박,Social
결국 강제수사 나섰지만  이선균 수사정보유출  면죄부 우려도,Social
울산 대왕암공원 바위 낙서범 잡고보니   대   가족 액운 털려고  ,Social
      폄훼  논란  인천시의장 불신임안 가결 의장직 상실,Social
 간만에 간 찜질방  요금 이게 맞아       년 이후 최고치 찍었다,Social
서천 전통시장 화재  차 합동감식   발화지점 집중 조사,Social
대설 한파 여파  전국 항공기    편 결항  도로도 곳곳 통제,Social
순직한 소방관 딸 위해 생일파티 열어준 동료들  훈훈 ,Social
 류희림 위원장님께 묻습니다  방심위 내부 저항은 이렇게 시작됐다,Social
제주공항 운항 재개 오늘    편 운항 예정,Social
 매진된 콘서트 티켓 팔아요       만원  먹튀 한   대 실형,Social
윤통 패딩에 주목한 언론    화재 피해 상인들 분노는 삭제됐다,Social
저출생 파격 대책 내놓은 서울시의회  현실화까지는 ,Social
 민폐 주차  차량에 주차금지 입간판 올린   대 항소심서 무죄,Social
사흘째 북극 한파 추워도 너무 춥네  뉴시스    ,Social
남성만  영업직 인 회사   영업직 만 승진했다  간접 성차별  인정 플랫 ,Social
제주 하늘길 열렸다    일  만여명 제주 빠져나간다,Social
 김주열 열사 역사 탐방한 아이들  그날의 아픔 이해하고 애도 ,Social
검찰   장학회 돈 횡령  김만복  국정원장 집유 선고에 항소,Social
주호민 부부  아동학대로 신고 당해  아이가 가정에서 폭력 모방한 듯 ,Social
호남 사흘째 폭설에 최고     쌓여 제주공항 항공편 운항 차질,Social
부산항 북항 재개발지역  이순신대로    일 개통,Social
인구 줄어 의대 증원 불가   고령화로 의료 서비스 급증 ,Social
제주공항 운항 재개   해안지역 눈 약해져,Social
 기후동행카드  판매 첫날부터 인기 누가 쓰면 이득 ,Social
제주공항  오늘 비행기 뜬다 대형항공기 등 체류객 수송 총력,Social
학생들에  합성 능욕  당한 교사  되레  아동학대 로 피소,Social
주차단속 시간 조정에 뿔난 용인 지역 상인들,Social
오늘은 뜬다   제주공항  항공기 운항 정상화,Social
서해안 사흘째 폭설   강추위에 도로도  꽁꽁 ,Social
광주 전남 대설특보 오전까지 최고      눈,Social
밀양시 글램핑장 불  인명피해 없어    만원 재산피해,Social
중대재해법 확대 적용     정부   에 개정 요청     만 근로자에 피해 ,Social
 배달의민족  배달 취소 피해 업주에 전가  알고리즘 변경 논란,Social
 고  이라고 속이고는     대 남성    대 여학생에 성범죄,Social
      폄훼 논란  허식 의장 불신임안 가결  의장직 박탈,Social
울산 대왕암공원  바다남  낙서 범인  집안 남자들 좋은 기운 받으라고  ,Social
총선 앞두고 대책 없는 감세에도 언론들  호평  일색,Social
울산 기암괴석에  바다남  낙서한 범인은   대 여성 대체 왜 ,Social
김두관 민주당 경남도당위원장  균형있게 국회의원 배출 응원해 주시길 ,Social
코로나 때   대 여성이 남성보다 극단 선택 충동  배 높았다  왜 ,Social
최강 한파에 전국  꽁꽁  동파 한랭질환자 속출,Social
 이선균 수사보고서 유출  압수수색 당한 디스패치  경찰 치부 덮는 데 쓰지 않길 ,Social
 시속    로 주행해 차량 정체  느림보 운전한 유튜버  결국 ,Social
인천 자월도에 주차된 차량서 남녀  명 숨진 채 발견,Social
장례식장 난투극 벌인 조폭들에 유죄 선고  영화  친구  모티브 조직,Social
고 인 척 미성년자 속여 룸카페서 성폭행한   대  가족에 범행 발각,Social
 압수된 돈 돌려줘  보이스피싱 환전책  국가 상대 소송 패소,Social
 통로에 왜 주차해  차 지붕에  주차금지  간판 올린 주민  무죄 ,Social
   치안감 등 경찰관  명 영장 사건브로커 통해 승진 청탁 혐의,Social
 콘서트 티켓 팔아요       만원  먹튀 한   대   징역  년 ,Social
압구정 롤스로이스   오늘  심 결론   징역   년 구형,Social
 바다남  울산 대왕암공원 페인트 낙서한   대 여성  이유는 ,Social
한파 대설 피해 계속   항공기    편 결항  계량기 동파    건,Social
들개가 사람 얼굴까지 물었다 부산시민공원 포획 나서,Social
 단독  교육부   음대 교수 입시비리 의혹  경희대 현장조사,Social
눈보라 잦아든 제주공항 항공기 운항 정상화,Social
부산 동래구 상가에서 불  건조한 날씨 속 화재 잦아져,Social
 출생 교육 돌봄까지  부산형  트리플 케어  늘봄 프로젝트 본격화,Social
체감온도 영하   도   기록적 한파  금요일까지 지속,Social
 아이가 모방한 듯  되레  아동학대  신고 당한 주호민  허위 사실 ,Social
     만원 돌려줘  범죄피해금 반환 요구한 보이스피싱 환전책,Social
정부    년 만에  단통법  폐지  지원금 경쟁으로 소비자 편익 늘리겠다 ,Social
제주 항공편 서서히 재개 발 묶인  만명 공항으로,Social
 다이어트 한 것도 아닌데 저절로 살 빠졌어요  빨리 병원 가야할 이유,Social
이경민 영도구의회 의장  김기재 구청장 폭행 혐의 고소 취하,Social
 가족 액운 막기 위해   울산 대왕암공원 낙서   대 여성 붙잡혀,Social
 출산율 꼴찌 에 특단 대책 내놓은 김현기 서울시의회 의장  소득 기준 제한 없애자 ,Social
  카톡서 발견된 남편의 불륜  알고보니 상대는 아파트 동대표 ,Social
김포 마산동 고등학교 불 인명피해 없어,Social
    사건 브로커  인사청탁 의혹 현직 치안감 등  명 구속영장 청구,Social
      왜곡 신문 배포  허식  인천시의장직 상실 불신임안 가결,Social
      폄훼 인쇄물  돌린 허식 인천시의장 결국 의장직 박탈,Social
 수업시간    기기 사용  시간 늘수록 수학 점수  점씩 하락 ,Social
셀트리온   우시와     신약개발 맞손  임상물질 생산 ,Social
검찰   장학회 돈 횡령  김만복 전 국정원장 징역형 집유에 항소,Social
 살려주세요    원   년째 온라인구걸  그 시간에 일하면    만원 벌었겠다 ,Social
  인 미만 중대재해법     장관들  유예해야  마지막 호소,Social
한파 속 전국 곳곳에서 화재 잇따라,Social
부모에  예비  이랬는데  룸카페서   살 여아 성범죄 저지른   대 ,Social
한라산     눈 폭탄에 영하권 사흘째 꽁꽁 언 제주,Social
호남지방 대설특보 오전까지 최고      눈,Social
 핫클릭  핵 위협 기후 변화에  지구종말시계  올해도   초  ,Social
수리하던 엘리베이터가 갑자기   대 작업자 추락사,Social
보이스피싱 환전책  체포 당시 압수한  천만 원 돌려줘  소송,Social
다산신도시 힐스테이트 지금 디포레  영화관  씨네큐  오픈  다이소  입점예정,Social
엘리베이터 수리하던   대 기사 추락 사망,Social
광주 전남 중소건설사 줄줄이 법정관리 신청,Social
나도 모르게 취소된 항공권    가족여행이 악몽이 된 순간,Social
 말기 간질환 생체이식 생존율 더 높다  이식대기 줄까,Social
 자막뉴스  돼지머리 무혐의  너무 당연한 결과     이슬람 사원 안갯속,Social
 사흘째 영하권 강추위  광주 전남 최대       많은 눈,Social
이경규 장도연 억대 출연료 못받아 기획사 대표 횡령 혐의 집유,Social
제주공항 운항 재개  일부 결항,Social
 담임 얼굴에 비키니  합성  피해 알리자 학부모들  아동학대  신고,Social
한파 대설에 항공기    편 무더기 결항 여객선도  꽁꽁  묶였다,Social
광주 사흘간 눈        미끄러지고  꼬리물고  출근길 엉금엉금,Social
 제주도 갈때 항공편 꼭 확인해야 ,Social
영화  친구  조폭들   친구 복수한다 며 장례식장서 난투극하다 처벌,Social
부산 상가건물서 불  인명피해 없어  명 대피  명 구조,Social
 경찰 인사 청탁 관여  혐의 현직 치안감 구속영장 청구,Social
 티켓 싸게 판다 며     만원  먹튀 한   대 결국 감방 ,Social
춘천출신 육동인 전 청와대 춘추관장  경인여대 신임 총장 선임,Social
   가 하사한  조 원 수표  거짓말로  억 뜯어낸 사기꾼,Social
제대로 작동 안 한 소방설비 서천시장 화마 키워,Social
재난 현장서 순직한 소방관 딸 위해 생일파티 열어준 동료들,Social
  월   일 수  오늘  서울시   엄마아빠택시    개 전 자치구서 확대 시행,Social
울산 대왕암공원 기암괴석 낙서 범인 잡아  액운 막으려 낙서 ,Social
 내 손톱 망가진다  갈비탕집 알바생에 오렌지 까달라고 요구한 손님,Social
불산 누출 후 주민들 기침 가래 호소  개연성 있어     만원 배상 ,Social
 아직도 네 서방 안 나서네    년 전 이혼한 전처 스토킹한   대,Social
강남구  첫 아이 낳으면 최대    만원 지원 서울 전체서 유일하게 출생아 증가,Social
정부 보조금   억원  꿀꺽  허위 서류로 지원금 받은 교육업체,Social
인천 자월도 차량서 남녀  명 숨진 채 발견 경찰 수사,Social
호남 사흘째 폭설에 최고     쌓여 제주공항 항공편 운항 차질,Social
회원 엉덩이 움켜쥔 트레이너 성추행  무혐의 ,Social
 재판 지연 해소  법원  시니어 판사 도입    활용 검토,Social
보이스피싱 환전책  체포 당시 압수한  천만원 돌려줘  소송,Social
일평생 약자를 사랑하고 보호자가 된 목자  마지막 길엔 장기기증 그립습니다 ,Social
전국 한파 대설에   일까지 항공    편 결항 다행히 인명피해 없어,Social
강원 산지는 체감    도 전국 덮친 한파 오늘도 이어져,Social
 제자리에서 빙글빙글    석달 째 폐그물에 걸린 아기돌고래 운명은   영상 ,Social
오늘은 비행기 뜬다 눈보라 갇혔던 제주공항  셧다운  해제,Social
 우리 애는 왕      왕자처럼 대하라  논란된 학부모 근황,Social
   가 나한테  조원 수표 줬다  거짓말로  억원 편취한   대,Social
 상습 교통체증  자유로 고양시 구간 지하 고속도로화 추진,Social
김영미 예비후보  지방 살려야 서울도 살고 국가도 산다 ,Social
은평구 아파트  층 안방서 불 주민  명 병원 이송,Social
 치매 진단     년 전 뇌 회색질 두께 얇아져 ,Social
내일 출근길도 한파 계속 서울 아침 최저     도 ,Social
명절 장사 앞두고 쌓아둔 물건 모두 타   상인들 망연자실,Social
 단독      달러 여비하세요   시의원에 돈봉투 살포  양주시장 송치,Social
사흘째 연이은  눈폭탄   남부권 도로 끊기고 사고 속출,Social
북극발  최강 한파  한랭질환 등 피해 속출,Social
경찰     이선균 수사 정보 유출 의혹  디스패치 압수수색,Social
 결혼 약속한 딸을    회 찔렀다 우발적이라고   유족의 절규,Social
 고교학점제  내년인데  입시는 그대로  나만의 시간표  성공할까,Social
 도로 얼어붙고 고드름 생기고  부산 한파 강풍에 신고 잇따라,Social
미성년자 속여 룸카페서 성폭행한   대   피해자 부모에게  예비 고교생 이라 소개,Social
 고교 패러다임 전환  문 정부 교육공약  호 정시 늘리며 엇박자,Social
김포 한 고교서 한밤중 화재  시간  분 만에 완진,Social
  살 삼양  열무비빔면  역사속으로  팔도에 밀려 생산 중단 ,Social
 콘서트 티켓 팝니다  중고나라     만원  먹튀    대 징역 년,Social
 상품권 콘서트 티켓 팔아요      만원 먹튀한   대 징역  년,Social
     건물주에 휴지값     만원 받아내고도 웃지 못한 이유,Social
한파 속 전국 곳곳에서 화재 잇따라,Social
최강 한파에 건설 현장도  비상   년간 미끄럼 추락사    명,Social
 내일날씨   서울 아침 최저    도  출근길 한파 계속,Social
제주공항 운항 재개   대설 강풍에 출발 지연 속출,Social
 대설특보  지속 제주공항 운항 점차 정상화   사전 결항   여 편,Social
몸에 폐그물 감긴 채 제자리  빙글  아기돌고래  석 달째 고통,Social
      조끼 입고 계단  소방관 체력시험  남녀 기준  같아진다,Social
강남구에서 출산하면 첫달 최대    만원 받는다,Social
 노출 에 담임 얼굴 합성하더니  문제되자  아동학대 로 역신고,Social
빼돌린 정부 보조금    억대  교육업체 대표  태국으로 도주,Social
 우리 끝까지 가보자    년 전 이혼한 전처 스토킹한   대,Social
 엉덩이 주물렀는데     트레이너  성추행  무혐의  왜,Social
 미국 치대 유학 보내줄게  거짓말로     만원 뜯은   대  징역  개월 ,Social
대장동 재판   일 만에 재개됐지만 이재명  재판부 허가로 오후 퇴정,Social
서울 영하   도 등 전국 종일 영하권 강추위 충남 호남 제주 많은 눈,Social
     폭설  제주 공항  만명 발 묶였다  모레까지 전국 칼바람,Social
 이경규 장도연 등에 출연료 미지급  기획사 대표 횡령으로  집행유예 ,Social
 최저 영하     도  강추위 폭설로 항공기    편 결항,Social
 인터넷 와글와글   일왕 외동딸  아이코 공주  취업한다,Social
 콘서트 티켓 팔아요    명에     만원  먹튀     대의 최후,Social
결혼 앞둔 여친    회 찔러 살해 숨진 딸 공개하며 중형 촉구한 유족,Social
 인터넷 와글와글  한소희  나탈리 포트먼과 인증 샷 공개,Social
동대문구청 압수수색    청량리 재개발 특혜  있었나   띵동 이슈배달 ,Social
서울 낮 기온도   도 강추위 바람 강해 체감온도 ,Social
 남편 죽을 수도  신고   출동하니 집단 마약,Social
 학생들 볼 자신 없어   담임 얼굴 합성  손가락욕   신고했더니 되레  아동학대 ,Social
제주 눈길 미끄러져 꽈당   교통사고 쾅      명 병원행 ,Social
 차선변경 알려준다 며 일부러 거북이주행 교통체증 일으킨 유튜버,Social
 체감온도      도  깜짝 놀란 출근길 모레 아침까지 전국이  꽁꽁 ,Social
 인터넷 와글와글   짧은 머리  유아인  우울증 앓았다 ,Social
 나흘간     눈폭탄  제주 도로도  하늘 바닷길도  꽁꽁 ,Social
순직 소방관 딸 위해 생일파티 열어준 동료들,Social
   가 하사한  조 수표  거짓말로  억 가로챈   대,Social
 화단에 마약 뒀다   던지기 하며 가상화폐로 거래한 남성 징역  년,Social
남편 추락사 현장 찾아온 베트남 아내 원인 규명 사과 요구,Social
현대위아  작년 해외서  조   억 원 규모 등속조인트 수주,Social
야근한 직원에게  별 보러 가자  성희롱 욕설 일삼은 삼바 간부들,Social
인구 줄 테니 의대 증원 안 된다       년 입원일     늘어날 것 ,Social
  매체  북한  김정은 지시로 통일 대헌장기념탑 철거 ,Social
 콘서트 티켓 팔아요      만원  꿀꺽 한   대 실형,Social
 김용 재판 위증교사  이재명 캠프 관계자  명 구속기한 연장,Social
하지정맥류 시술비 부풀려   억 보험사기 병원장 브로커 징역형,Social
경기 화성 야적장서 불   명 중상,Social
전국 한파 피해 계속 항공기    편 결항  수도계량기    건 동파,Social
 출근길 인터뷰  전국 혈액 보유량  뚝  텅 빈 혈액 저장고,Social
광주 광산 누적       폭설 순천      도 출근길 한파 사흘째,Social
 위안부는 자발적 매춘  류석춘 전 교수 오늘  심 선고,Social
재난 현장서 순직한 소방관 딸 위해 생일파티 열어준 동료들,Social
수리 중 갑자기 엘리베이터 작동 평택 공사장서   대 추락사,Social
 이선균 수사 보고서 유출  디스패치  압수수색 당했다,Social
강추위에 발묶인 한반도  대설에 교통사고도 잇달아,Social
춘천 스키숍서 불   천만원 재산피해 시민들 대피소동,Social
반려견 청년 얼굴 문 부산 도심 들개  포획은  아직 ,Social
 아침에 한 장  추울 때만 찍을 수 있는 사진,Social
정유라  소개팅 햄버거 나눠먹었다니 김남국  진짜 가지가지 한다  조롱,Social
 끝을 보자    년 전 이혼한 전처 스토킹한   대  징역  년,Social
이경규 장도연  수억 원 출연료 못 받아 기획사 대표  횡령 혐의 집유,Social
    중 엉덩이 아예 주무르더라  신고했지만  무혐의 처분  이유는 ,Social
제주가 얼어붙었다  최강 한파에 하늘길 바닷길 출근길 모두  꽁꽁 ,Social
 이슈분석  이재명   대장동 재판  출석했다 중도 퇴정,Social
 월 이후 입국 외국인부터  개월이상 거주해야 피부양자 자격,Social
 이경규 장도연  억대 출연료 미지급 기획사 대표 횡령 혐의 집유,Social
  대 소녀 룸카페 데려가 성폭행한   대   예비 고 이라고 소개하더라 ,Social
대관령 아침 체감온도 영하     도 강원 전역 강추위,Social
한파 속 서울 은평구 아파트서 불 화성 야적장서도 화재,Social
아시아나  밀린 기내식 대금 항소 포기      억 물게 돼,Social
 담임 얼굴 비키니 몸에 합성  수업중 손가락욕 신고하자 되레  아동학대 ,Social
오늘도 매서운 출근길 한파 서울    도 춘천    도,Social
 현재도 의사인력 충분   고령화로     년에만 입원일     늘어날 것,Social
 미국 치대 보내줄게  거짓말로 수천만 원 뜯은   대 실형,Social
 차별 아닌가요  단국대  우수학생  파격지원 에 학생 반발,Social
재난     로 본 광주 전남 대설 상황은 ,Social
결혼 약속한 여자친구 흉기로    회 찔러 살해한   대  감형받은 이유,Social
룸카페에   살 데려간   대   부모에  저 예비고   거짓말,Social
 의도치 않은 체중 감소는 암 위험 신호 의사 상담받아야 ,Social
     광주 전남 사흘째 폭설  도로 곳곳  빙판길 ,Social
차량 위 쌓였던 눈이  흉기 로    쌓인 눈 꼭 치우세요   앵커리포트 ,Social
 콘서트 티켓 팔아요      만원  꿀꺽    대  결국 감방 ,Social
 콘서트 티켓 싸게 팝니다      만원  먹튀 한   대  결국,Social
 특보  광주 전남 대설특보 오전까지 최고      눈,Social
 날씨 출근길 한파 계속  서울 체감      호남 제주 많은 눈,Social
 엉덩이 움켜쥔   트레이너  성추행 아니라니    회원 분통,Social
검찰  백윤식 허위 고소 혐의  전 연인 불구속 기소,Social
 대북송금  김성태  년 만에 보석 석방  재판에서 다 드러날 것 ,Social
   원이라도 벌어야  이 추위에도 폐지 줍는 노인들,Social
서해안 사흘째 폭설   강추위에 도로도  꽁꽁 ,Social
