titles,category
이석현      갈등은 한동훈 한판승 최대 피해자는 이준석 신당   뉴스와이드 ,Social
안부 물으려 공유한 연락망   강서구 아파트 화재 참사 막았다,Social
이선균 수사보고서 그대로 인천경찰 디스패치 압수수색,Social
외국인 노동자의  비닐하우스  나기  온열기 하나로 버텨요 ,Social
      신생아 느는데 의료인력도 시스템도 부족  풀영상 ,Social
    만 달러 대북송금  혐의 김성태 쌍방울 전 회장 보석 석방,Social
종로구 신축 공사장    높이서 인부  명 추락  명 사망,Social
 나 대치동 수학강사야  술값   만원 먹튀한 손님은 노숙자,Social
 고등학생이랬는데  미성년인 척   살에게 접근해 성폭행한   대,Social
홍삼 모델 발탁된 조민  초등학교 이후 한복 처음 ,Social
 울면서 빌었어요  직접 병원 찾아나선 고위험 임신부,Social
평창 가스 누출 사고 잊었나  업체 또다시 가스 누출 ,Social
 새벽 별 보러 가자  성희롱 욕설 일삼은 삼성바이오로직스 간부들,Social
 단독  사진 합성에 욕까지  교권 피해  신고했더니  황당 ,Social
교각 들이받은 전기차 순식간에  활활  출근하던 운전자 숨져,Social
검찰   대림역 흉기 난동 예고    대  심 집행유예에 항소,Social
 대북송금 혐의  김성태 전 쌍방울 회장 보석으로 석방 종합 ,Social
 결혼하고 싶지만  자만추  쉽지 않아요  지방 청년들의 하소연,Social
고 이선균  수사정보 유출 의혹  인천경찰 언론사 압수수색,Social
 년 연장 확정한 날에  부역자 선별  하겠다는 김광동,Social
전국 냉동고 추위 왜  북극한파 내려오는  고속도로  뚫렸다,Social
눈 폭탄에 하늘길 뱃길 끊겼는데  최고       더 온다,Social
설 대목 앞두고 날벼락 윤 대통령  특별재난지역 검토 ,Social
 주말엔 그나마 젊은 사람 나왔는데  대형마트 공휴일 휴무 폐지  시민 반응은 ,Social
 이러다 큰일  폐그물에 걸린 새끼 돌고래 이상행동 나타나,Social
강풍 타고 불씨 번져    개 점포 재로 만든 구조까지,Social
평창동서 남녀 여럿 눈 풀려 비틀비틀 팔에 마약 주사자국 있었다,Social
결혼 약속한 여친     회 찔러 살해했는데 겨우    년형   유족  분노 ,Social
사상 첫 검사 탄핵소추안 늑장 변론 시작,Social
 사장님 나빠요   악몽에 갇힌 이주 노동자  집중취재 ,Social
 고기인지 지우개인지  논란 터진  비계 폭탄 삼겹살  업체  결국 잘렸다,Social
 엉뚱한 이유 로 불신임안 셀프 거부 허식  사퇴 지시 없었다 ,Social
눈보라로 무더기 결항 제주공항에  만 명 발 묶였다,Social
  일 만에 재개된 대장동 재판 이재명 중도 퇴정,Social
법무장관에 박성재 전 고검장  사퇴 파동  뒤 조직 동요 차단 ,Social
호남 제주 이틀째 대설특보 내일까지      눈 더 온다,Social
 채상병 사건  의혹 많지만 수장 공백에 수사 동력 약화 우려,Social
불꽃 튀더니 삽시간에  활활  서천시장 화재      영상 보니,Social
이선균 공갈 피의자 기소 수사정보 유출 의혹 강제수사,Social
여직원 몸 만지고 야근 도중  별 보러 가자  성희롱 실태,Social
 난 대치동 강사  오늘 쏜다    만원 먹튀  알고 보니 노숙자,Social
 여야  대   방심위  회의에서 사라진 류희림 위원장 민원사주 의혹,Social
 다시 간다 흉물 된 도심 폐교 다른 쓰임새도 난망,Social
   억원대 횡령 혐의 김성태   쌍방울 회장 보석 석방,Social
 녹말 이쑤시개 튀김  먹방 유행    식약처  먹지 마세요 ,Social
미성년자 룸카페 데려가 성범죄 저지른   대에 구속영장 신청,Social
 날씨  전국 강추위 지속 아침 최저기온       도,Social
제주 오가는 하늘길 모두 막혀   만 여명 발 묶여 ,Social
 발목 잘릴 듯한 추위  체감온도 영하   도 계량기 동파도 잇따라,Social
 뉴스프라임  누가 이선균 수사 정보 흘렸나 경찰 언론사 압수수색,Social
설 대목 앞두고 상인들 망연자실 평생 일군 터전이 잿더미로,Social
 뉴스레터   충주시 홍보맨 김선태  용산행  제의 온다면 긍정적으로 고려 ,Social
 층에서 불빛 번쩍이더니 순식간에 서천시장 화재로 점포    곳 잿더미,Social
배우 백윤식 전 연인  무고 혐의로 재판행,Social
 뉴스추적   배민에 내는 광고비만 매달    만 원  정작 배달은 늦다 ,Social
 단독 집 안에  마약금고 까지 두고 마약파티,Social
유아인  우울증 앓아 프로포폴 투약은 인정 ,Social
 대림동서 칼춤 추겠다    대  집행유예  반성 없어  검찰 항소,Social
경찰   청량리 재개발 비리 의혹  동대문구청 압수수색,Social
 밤  시 회의    분컷 실패에 무더기 경위서 부시장도 지각,Social
서천시장 화재로 점포    곳 잿더미 상인들  망연자실 ,Social
 괴한에게 인종차별 폭행당했는데 외교부 답변에 한숨 ,Social
적자    억에 직원 월급도 밀릴 뻔 제주대병원 무슨 일 ,Social
한 달에 세 번     누출 사고 모두 한 업체,Social
눈 속에 파묻힌 호남 서해안 내일까지      더 내린다,Social
 친절한   오영훈 지사  선거법 위반 유죄    만 원  판결의 의미는 ,Social
아내가 돈 벌어 생활해 열등감 있던 남편 대출 거부하자 살해 징역   년,Social
북극 한파에 서울 체감      도 전국  꽁꽁  이번주 내내 강추위,Social
곗돈 돌려막기로  억 꿀꺽한   대 여성 광양 일대  발칵 ,Social
땅 팠더니 유물  우르르   공사 전면 취소해야 ,Social
 고속철도 신칸센  정전사고로 대규모 운행 중단,Social
윤 대통령  법무장관 후보 박성재 내정  조직 안정 방점 ,Social
 납치당했다      신고 미출동 유족   억 원대  소송,Social
유동규  이재명 선거공약  내가 주도적 설계 ,Social
   만 달러 대북송금 혐의 김성태 쌍방울 전 회장 보석 석방,Social
 청량리  구역 재개발 비리  관련 동대문구청 압수수색,Social
진실화해위  년 연장  진실규명률 높여야  종합 ,Social
폭설 강풍에 발 묶인 제주공항    편 결항,Social
    시청자위     인수위 출신  등 합류,Social
검찰      고가 매입 의혹  박성빈 전 스파크 대표 소환,Social
남편 추락사 현장 찾아온 베트남 아내 원인 규명 사과 요구,Social
화재 감지됐어도 속절없이  활활  점포    곳 전소,Social
 설 앞두고 망연자실  평생 일군 일터 잿더미,Social
 의사 늘어도 진료비 상승 미미  의사단체 반박  토론하자 ,Social
 단독   바리캉 폭행  가해자 억대 기습공탁    피해자  감형 시도 ,Social
검찰   대림역 흉기난동 예고  집행유예 판결에 항소,Social
 남편 죽을 것 같아요  남녀  명  평창동 빌라서  집단마약  체포,Social
 북극 냉기 에 전국 한파 폭설 강풍 제주 항공편 무더기 결항,Social
 떳떳해지고 싶다  전청조 주장에  재판장  단어 사용 생각 좀 ,Social
 이쑤시개 튀겼더니 스낵처럼 바삭  레시피 유행에 식약처  안전성 검증된 바 없어 ,Social
계량기 터지고 항공기    편 결항  최강 한파  피해 속출 종합 ,Social
일년에 열 번도 안 입고 버려지는 교복 자원 낭비,Social
폭설 강풍에 막힌 제주 하늘길    여 편 무더기 결항,Social
승객 줄고 운수업체 재정난 서울에도  스타리아 마을버스 ,Social
 년 전 다툼이 살인까지 중학교 후배 살해한   대 중형 확정,Social
  분 만에 떠난      왜 왔나  서천시장 상인들 분노,Social
 사진 찍으러 왔냐    한동훈 못 만난 상인들 불만 폭발,Social
 최강한파 에 전국이  꽁꽁  계량기 수도관 동파되고 하늘길 뱃길 끊겨,Social
    만달러 대북송금  김성태 쌍방울  회장 보석 석방,Social
소방관 체력시험  남녀 지원자에 동일한 평가 기준 적용,Social
 포스코 호화 이사회 의혹  고발인 조사  사외이사들 물러나야 ,Social
이재명  대장동 재판  출석했다 몸 상태 악화로 퇴정  검찰 불편한 기색,Social
호남 제주 내일까지 폭설 최대      ,Social
범대본  문   대통령 고발 관련 친문 국회의원들과  대립각 ,Social
    재난안전지도      이 시각 전북 대설 상황은 ,Social
고온 한파 눈 대신 비 이례적인 겨울,Social
김주하 앵커가 전하는  월   일     뉴스  주요뉴스,Social
세종  생활권 외곽순환도로 개통효과  뚜렷   도심 정체 줄었다,Social
충북 전역 한파특보 강추위 절정,Social
전북  개 시군 대설특보 내일까지     넘는 눈,Social
판다 푸바오 환송행사 준비하는 에버랜드,Social
차세대    퀸 예약  조민  화장품 이어 홍삼 광고도 접수,Social
      폄훼 논란  허식 인천시의장 불신임 불발  본인이 상정 거부,Social
    년부터 소방관 체력시험  남녀 동일 기준  적용,Social
평택 아파트 공사장서 엘리베이터 수리기사 추락사,Social
어른 주먹보다 작은 아기 더 살려야,Social
일터에서  개     씨      삼바 직원 절반  괴롭힘 성희롱 직간접 경험 ,Social
    트레이너가 움켜쥐고 주물러  성추행 신고했지만  무혐의 ,Social
강풍 폭설 몰아친 제주공항  마비      여편 결항에 승객  만명 발묶여,Social
카카오와     시세조종  공모 사모펀드 운용사 검찰 송치,Social
   명대 출산율에 서울시의회  저출생정책 소득기준 폐지 제안,Social
대설 대책회의 늑장대처 충주시 간부 무더기 경위서,Social
검찰  배우 백윤식  연인  무고  혐의로 불구속 기소,Social
서천 특화시장 피해 상인들    대통령에  들여다보지 않고 보여주기식  비난,Social
이재명  대장동 재판  몸 상태 악화로 오후 퇴정 재판부  출석은 원칙 ,Social
검찰  현직 치안감 뇌물수수 혐의로 구속영장,Social
 고발 사주  조성은  입당원서     장 위조 혐의 재판행,Social
청부민원  윤석열이 완성한   대   방심위   대통령 욕설 논란  보도 징계 예고,Social
 매일 아이 몸에     번 주사   형 당뇨 가족의 눈물,Social
영화관 화장실에 다른 층 손님이 우르르  법원     에 휴지값 돌려줘라 ,Social
대출 대가로 수억원 챙긴 전 신협 임직원 기소,Social
  이선균 사건 경찰 언론 비판  디스패치 압수수색,Social
청부민원   셀프 연봉 인상  류희림  하루만에 들통난 거짓말,Social
   명대 출산율에 서울시의회  저출생정책 소득기준 폐지 제안 종합 보 ,Social
평택 아파트 신축 공사장서   대 작업자 추락사,Social
동호회서 친분 편의 제공 뒷돈 챙긴 전 신협 간부  명 기소,Social
부산대 총장 선거 후보  명 등록 선거운동 본격화,Social
엎친 극강 한파에 덮친 거센 바람  부울경이 시렸다,Social
룸카페 데려가   대 딸에 성범죄   대  가족이 현장 잡았다,Social
줄지 않는 노동자 죽음  모호한 법 손질 시급,Social
 악성 저성과자 해고는 정당  기업 고용유연성 인정한 대법,Social
 대북송금  이화영 재판 지연에 김성태  년 만 보석으로 석방,Social
 자막뉴스  아무리 치워도 치워도   습설 퍼붓더니  또 악재 ,Social
포항지진범대본   시민단체 겁박하는 국회의원 제명 퇴출시켜라 ,Social
한파 대설 몰아친 제주  항공편 무더기 결항 사고 속출,Social
 행복한  판생  응원할게  푸바오  월 초 한국 떠난다,Social
 무기징역 도 억울했나  등산로 살인  최윤종  피해자 때문에 살인자 됐다 ,Social
이선균 협박범  명 기소 수사한 인천경찰 압수수색 당해,Social
 단독   청량리 재개발 비리  동대문구청 압수수색    공무원 불법 특혜 분양 ,Social
대구 이슬람사원 옹호단체  검찰의 돼지머리 무혐의 결정은 안일한 인식 ,Social
 개인     원래 이렇게 해요   성추행 논란  살펴보니,Social
추락사한 베트남 노동자 아내  국내서 원청에 사과 요구,Social
   대      대 딸과 룸카페서   가족이 범행 현장 덮쳤다,Social
눈보라 휘날리는 제주공항    여편 무더기 결항  만여명  발 동동 ,Social
 신종마약 못잡는다   수영장에 떨어진 물질 한방울도 검출   마약중독과 싸우는 사람들 ,Social
사치 빠져 사기 범죄까지  구청장 딸 빚 돌려막기하다 이 지경,Social
대전 한전기술 원설본부 김천 이전설에 반발 확산 총선 앞두고 정쟁거리 전락 논란,Social
김종구 주몽골대사  고발사주  조성은  입당원서 조작 혐의로 기소,Social
제주공항 항공편 무더기 결항 폭설에 갇힌 호남 제주,Social
 특보  광주 전남 대설특보 여객선 항공편  결항 ,Social
 너희들 이젠 고마해라   영화 친구  조폭들  장례식장서 둔기 들고 난투극,Social
수원 평택서   억 규모 전세사기 의혹 피해자   명,Social
국민 환자 볼모  단체행동  위협한 의사단체 정부  엄단 ,Social
    만달러 대북송금 의혹  김성태 전 쌍방울 회장   년 만에 석방,Social
강추위 속 위기의 배달 노동자 한랭 질환 비상,Social
충남 서천 수산물특화시장 큰불   상인들은  망연자실 ,Social
논란의  녹말 이쑤시개  튀김 식약처  먹는 것 아니다 ,Social
 한동훈 후임 법무 장관 에 돌연 박성재 지명    살아있는 권력  수사 통제 강화 ,Social
   년된 자운대  노후시설 개선 유휴부지 개발해야  계룡스파텔 전철 밟을 우려도,Social
튀기면 다 맛있다   녹말 이쑤시개  식품 아닙니다  식약처 긴급 경고한 이유,Social
폭설 이어 강추위   청소년 올림픽  방한  총력,Social
 유령 노조  걸러냈더니  조합원수   년만에 줄었다,Social
차량 보행자 빙판길 사고 잇따라 최강 한파에 전국서 피해 속출,Social
검찰  대림역 칼부림  예고글   대 집행유예에 항소,Social
마약사범 감형 수단이던  던지기     지금은  비대면 마약 거래  통칭  김동규의 마약 스톱  ,Social
새카맣게 탄 서천시장 설 대목 앞둔 상인들 망연자실,Social
본인 예비신부    번 찔러 살해한 예랑이 징역   년,Social
 푸바오   월 중국으로 떠난다     월 초까지만 일반 공개  지금이뉴스 ,Social
 이쑤시개 튀김  먹방에 발칵 식약처  과섭취땐 구토 설사 ,Social
폭설 강풍에 막힌 하늘길    여 편 결항,Social
 반포 재건축  조합원에  억여원 뿌린 현대건설   심서 벌금형,Social
정치인 변호사 다음 많다  교육계 인사들 속속 총선 채비,Social
봉화 사고 겪고도 또  울진 텅스텐 광산 사고로  명 숨져,Social
 체감 영하   도  강추위에도  먹고사느라  버티는 야외노동자들,Social
수요일   일  낮에도 영하권 강추위 최저       꽁꽁 ,Social
 불법 대북송금 혐의  김성태 쌍방울 전 회장 보석 석방,Social
 단독     경찰 인사 청탁 의혹  현직 치안감 구속영장 청구,Social
유아인 머리 짧게 자르고 공판 출석  우울증 오래 앓아     김명준의 뉴스파이터,Social
유령 조합원 빼니 양대 노총   만명 줄었다,Social
수원 평택서   억원대 전세 사기 고소,Social
 대행체제  예상 깨고 법무부장관 후보 지명한  대통령  왜 ,Social
구미 봉곡동의 한 중학교서 화재 직원  명 연기흡입 부상,Social
      자루가    아래로  뚝      대 작업자 사망,Social
 회복에   년 걸려  이혼 후 신용불량자 되었던 서정희   김명준의 뉴스파이터,Social
 설 대목 앞둔 엄동설한에 어떡하라고    억장이 무너져요 ,Social
   대만 정당가입 허용 한국  공무원 정치활동 제약 과해 ,Social
 단독  사라진 세종대왕 태실 핵심 유물  반세기 만에 귀환   리포트 ,Social
 손 덜덜  난치질환 파킨슨  바이오  신약 개발 도전장,Social
식품회사  횡령으로 김수미 모자 고소 김수미 측  연예인 망신 주기    김명준의 뉴스파이터,Social
 남편 죽을 수 있다  서울 평창동서 남녀  명 집단마약 팔뚝에 주삿바늘 흔적,Social
한 달도 안 됐는데 강원 평창서 또  가스 누출  사고,Social
    만 달러 대북송금  김성태 전 쌍방울그룹 회장 보석으로 풀려난다,Social
서천 화재 현장서 만난 윤 대통령과 한동훈   김명준의 뉴스파이터,Social
국민 판다  푸바오  출국일 나왔다  월 초   쓰촨성으로,Social
고향사랑기부제 답례품 삼겹살  비계가 절반  결국 업체 협약 종료,Social
올림픽대로서 느릿느릿 시속      길막 주행  유튜버 논란,Social
경북도내 중학교 노래방서 불 잇따라 발생  명 연기흡입,Social
카카오와     시세조종  공모한 사모펀드 운용사 검찰 송치,Social
서울 한복판서 필로폰 투약한 남녀  명 검거,Social
경찰 지자체에 악성 민원  만 건  폭탄세례  부산  민원왕  구속,Social
서민위   이재명 헬기 이송 고발  이어 김어준 명예훼손 혐의로 고소,Social
 프로필  박성재 법무장관 후보자  과 막역한 검찰 선배 종합 ,Social
 단독  돈 문제는 출산 걸림돌 아냐  계룡  남매 부부의 행복 영상 ,Social
 씨리얼  스물여섯이지만 이장입니다  완도 토박이고요 ,Social
전공의      의대 증원 반대   복지부  불법 행위 엄정 대응 ,Social
 대북송금 혐의  김성태 전 쌍방울 회장 보석 석방,Social
 대설 대책회의 지각  충주시 간부 공무원 무더기 경위서,Social
곗돈 돌려막기  억 원 가로챈   대 구속 송치,Social
 단독 식품 기금 심사위원에  외식업 대표  구의원이 이해충돌 논란,Social
 대치동 강사라더니 노숙자 술값   만원  먹튀  누가 받아주겠나 ,Social
종로구 공사장서 인부  명 추락   명 사망,Social
 희망퇴직 위해 임금 반납하라  직원들  한전 망했다  부글,Social
 녹말 이쑤시개 튀김  유행 식약처 긴급 경고,Social
마트에서      오른 맥주  식당에서     나 올랐다,Social
 이쑤시개 튀겨먹자     서 열풍 홍윤화도 푹 빠졌다,Social
 이선균 협박   억     만 원 뜯은   대 여성  명 기소,Social
 인프라가 수요를 창출한다  달빛철도가 만들어낼 변화상은 ,Social
   엔터 시세조종  가담 혐의 검찰  사모펀드 운용사 본격 수사,Social
 돼지머리 무혐의로 억울함 풀려      이슬람 혐오 막아야  종합 ,Social
달성군  지표조사도 없이 도로공사 선사시대 유적 다수 훼손 의혹,Social
    만 달러 대북송금 혐의  김성태 보석 석방,Social
민간인에 간첩 누명 씌워  이중스파이  만든 방첩사 역용공작 드러났다,Social
  기기 손 못떼는 학생들 수학성적  뚝 ,Social
카시트 장착  엄마아빠택시  오늘부터 서울 전역 운행,Social
 자막뉴스  활주로 폐쇄까지    여 편 결항   발 묶인 제주,Social
울릉도 설국    으로 변신  이틀간     넘는 폭설 내려,Social
 이건 시작일 뿐   쉬는 일요일  사라지는 마트에 노동계 반발,Social
 대북송금  혐의 김성태 쌍방울 전 회장 보석 석방,Social
승리  해외 행사서  지드래곤 데리고 오겠다  발언에  아직도 빅뱅팔이  비판,Social
 날씨 내일도 한파에 강풍 제주 호남 충남 대설,Social
수원 평택서   억원대 전세 사기 의혹 경찰 수사 중,Social
김해 한 공장서      자루에 깔린   대 사망,Social
이광재  현 정부가 국민 외면받는 것은 먹고살기 힘들어서 ,Social
 영상   나 여기 도착 아닌데   옆 나라에서 착륙을 원전 멈추고 기차 멈추고  일상이 마비  겨울 폭풍이 유럽을 덮쳤습니다 ,Social
승객 못 보고 치어 숨지게 한   대 버스 기사     만원  벌금형 ,Social
지역화폐 뿌리던 지자체  발행 확 줄였다,Social
 불법 대북송금  김성태   쌍방울 회장 보석 석방,Social
최문순 전 강원도지사 업무상 배임 등 혐의로 경찰조사 받아,Social
룸카페서 미성년자와  부적절 성관계    대 체포,Social
자동차 부품 공장서    톤 자루에   대 노동자 깔려 숨져,Social
 단독 학부 등록금 동결  대학원생 유학생 등록금은      인상 추진,Social
여성직원 업무와 무관한 기준으로 승진심사  중노위  성차별  인정,Social
서울  대형마트 공휴일 의무휴업 폐지  발의 지자체 첫 후속조치,Social
 제주공항  만명 발 묶였다  강풍 폭설로 하늘길 끊겨,Social
 눈보라 몰아친 제주  항공편 무더기 결항 사고도 속출,Social
구미시 봉곡동 중학교서 불  명 연기흡입해 병원 이송,Social
 백윤식이 합의서 위조  주장한   세 연하 전 연인  무고 혐의로 기소,Social
 대장동 재판  본격 재개 두 달 만에 만난 이재명 유동규,Social
 가족 욕  퍼부은 주취자 뺨 때린 경찰 법원은 선처했다,Social
 고발사주  조성은 김종구 몽골대사  창당 문서위조 등 혐의로 기소,Social
돌싱남 재혼 다짐하는 순간  위  집밥 그리울 때  여성은 ,Social
 손가락 아픈데 이것 좀 까줘  알바생에 황당 요구,Social
외도 의심 아내 사무실에       차량엔 추적장치 단   대,Social
좌익세력에 일가족  명 몰살    년 지나도 전쟁 상흔 여전 ,Social
룸카페서 미성년자와 성범죄   대  가족들이 현장 잡았다,Social
    만 달러 대북송금 혐의  김성태 쌍방울 전 회장 보석 석방,Social
  한국반납공사 라 불러 달라  한전 직원들이 뿔난 이유,Social
태국서 오징어 사이에 필로폰 감춰 반입하려 한   대 실형,Social
 푸바오  잘가   월   귀환   월 초까지 일반 공개,Social
총선 출마 여지 남긴 이낙연  광주 전남 이삭줍기 나서나,Social
삼바 간부들      못 해 먹겠네   새벽 별 보러가자    폭언 성희롱 일삼아,Social
송영길  옥중 창당 선언   가칭  정치검찰해체당 ,Social
  년 간 함께 산 배우자 살해한   대 징역   년 확정,Social
철새 낙원에 드론 띄운 남성  찍지 말라  하자 하는 말,Social
김태흠 지사  윤대통령에 서천특화시장 재건    억 지원 요청,Social
에버랜드 자이언트 판다  푸바오   월 초 중국 귀환,Social
김해 한 공장서       플라스틱 자루에 깔려   대 사망,Social
 남편 죽을수도  신고에 출동했더니 빌라엔 성인 남녀  명  비틀비틀 ,Social
    제 노조  뉴스데스크 신났다  디올백 선전  앞장선     기자들   미디어 브리핑 ,Social
소방관 채용 시험 때 남녀 동일하게 체력 평가한다,Social
장례식장 난투극 벌인 부산 양대 폭력조직 조직원들 징역형,Social
  광안리 대첩  영광 되찾으려면 게임단 게임사 상생 위한 생태계 만들어야 ,Social
     첫 치료제 나온다    바이오도 출격,Social
평택 아파트 신축 현장서 작업자 추락사 경찰 노동부 조사,Social
 한전기술 원자로설계본부 김천 이전  대전시는 뭐했나 ,Social
무인점포      속  용변 테러   직접 잡겠다  점주 분노,Social
 없는 살림 에 흉물로 덩그러니 광주 신양파크호텔 혈세낭비 논란,Social
서천특화시장 화마 키운 소방설비 불길 치솟는데 감지 늦어 종합 ,Social
청소년 선수촌에  이것  뿌렸더니  대회 폐지해라  학부모들 발칵,Social
김수미  횡령이라니  우리가 피해자 명예훼손 책임 물을 것 ,Social
순직 소방관 딸 위해 생일파티 열어준 동료 소방관들,Social
 몸 아프다  이재명   대장동 재판  조기 퇴정,Social
가정폭력 의심 출동했더니 서울 평창동 빌라서 집단마약,Social
광주시  중앙공원 지구 선분양 검토  방침에 시민단체  특혜  반발,Social
 유령노조  걸러내니 노조 조합원 수    년 만에 처음 꺾였다,Social
 남편 죽을 수도  경찰 출동하니 수상한 남녀  명 팔뚝엔 ,Social
 온실가스  위 오명  충남  탄소중립 앞당긴다,Social
의대 증원 반발 전공의 집단행동 논의에 보건복지부 유감 표명,Social
지자체들  지역 건설사 살리기  안간힘,Social
서울 기후동행카드  불티   반나절 만  만  천장 판매,Social
 최대       폭설  광주 전남서 빙판길 교통 낙상 사고 잇따라,Social
최춘식 의원  제 순환고속도로 포천 남양주 내달  일 개통 ,Social
 스브스픽  한전 힘드니 임금 반납하라   거절하면 인사 불이익 ,Social
창원문성대 간호학과  교수 부족 사태에 폐과 위기,Social
 초미니 마을버스  서울도 등장 하차벨 없는 스타리아 투입 왜,Social
 내일 날씨  전국 하늘  맑음  아침 최저    도,Social
 단독  이정섭 검사 처남댁  휴대폰 포렌식 자료 제출  수뢰죄 해당 여지 ,Social
친형 살해   년만에 자수 징역   년 불복  쌍방 항소,Social
