titles,category
 년 전 아내 살해   대  재혼아내 또 살해  임의로 복약 중단  책임 피해자에게 돌려 ,Social
교수 없어 국가시험도 못 칠 판 창원문성대 간호학과 학생 근심,Social
인공지능  반려로봇 으로 중장년 고독사 막는다,Social
한파에 발 묶인 여객기들 오늘까지    편 결항,Social
재발 잦은 난소암  꼼짝마  피 한방울로 빠르게 잡는다,Social
재발 잦은 난소암  꼼짝마  피 한방울로 빠르게 잡는다,Social
법원 인사 시즌 돌입  주요 사건 재판부 교체  주목 ,Social
 못 해 먹겠네  폭언 성희롱 일삼은 바이오 대기업 간부들,Social
전국이 꽁꽁  한파  칼바람에 체감온도 ,Social
 뉴스딱  고향사랑기부제 답례품  비계 삼겹살  논란 업체  결국,Social
티켓 판다더니     만 원  꿀꺽    대 사기꾼 실형,Social
사흘째 제주섬 꽁꽁 항공편 서서히 운항 재개 전망,Social
신혼 때 전세라도  부자구  강남구에 살아야 할 이유 있네 ,Social
 뉴스딱   차가 비틀거린다  통영 한밤 추격전  아찔 ,Social
화성 야적장 큰 불  한때  대응  단계  밤사이 곳곳 화재,Social
 눈치 안보고 쉴 수 있는 유일한 곳  물티슈도 얼린 최강 한파에 쉼터 찾는 배달기사들,Social
만취 운전자  잡고 보니   년 전  사망  어찌 된 일 ,Social
 아침신문 솎아보기  윤 한 갈등 봉합  장면  바라본 조선일보와 동아일보의 차이,Social
 이경규 장도연 출연료 못받았다  횡령 혐의 기획사 대표 집유,Social
 돈만 받고 잠적  콘서트 티켓 사기   대 실형,Social
출근 늦어질라    눈길 교통혼잡  우려에 서두르는 제주도민들,Social
북극발  최강 한파  한랭질환 등 피해 속출,Social
 기후동행카드  판매 첫날부터 인기 누가 쓰면 이득 ,Social
고 인 척 룸카페서 미성년자 성폭행한   대 가족이 현장 적발,Social
 기후동행카드  판매 첫 날부터 인기 누가 쓰면 이득 ,Social
 남편 죽을 수도  출동해보니 서울 평창동서 집단 마약,Social
은평구 아파트 화재   여명 대피 강추위 속 화재 잇따라,Social
경찰   이선균 수사 유출 의혹  디스패치 압수수색,Social
      폄훼 논란  인천시의장  불신임안 처리 불발,Social
 혼자 일주일에   개나  식품 포장재가 대다수,Social
제주도  일째 온통  꽁꽁   항공편 운항 확인 필요 ,Social
올림픽대로서 느릿느릿 시속      길막  유튜버 결국,Social
 콘서트 티켓 판다 며     만원 뜯어낸   대 사기꾼 실형,Social
      조끼 입고  종목  소방관 체력시험 바뀐다,Social
 사반 제보  가게 천장 무너지더니 물  콸콸    순식간에  물바다 ,Social
 사반 제보  주변 살피더니   만원어치 민어  쓱    인천  생선 절도범 ,Social
 사반 제보  돈 뜯어가던 남친  알고 보니  유부남   피해여성   명 ,Social
이경규 장도연  억대 출연료 못 받아 기획사 대표   횡령 혐의  집유,Social
 상품권 티켓 팔아요  중고 사기꾼      만원  꿀꺽 ,Social
 이경규 장도연 출연료 미지급  기획사 대표 횡령 혐의 유죄,Social
 일요일도 문 연다   노동환경 악화 우려 ,Social
 딸 남자친구예요  룸카페에   세  데려가더니 성범죄 벌인  그놈 ,Social
요란한 소리 나길래 봤더니 창원시민 기겁한 사연  잇슈 키워드 ,Social
 옆집서 누가 싸워요  출동한 경찰  경악   잇슈 키워드 ,Social
 대북송금  쌍방울 김성태   년 만에 보석 석방,Social
설 대목 앞두고  망연자실  윤 대통령  적극 돕겠다 ,Social
   억 범죄수익으로 초호화 생활  만원권 돈더미도 발견,Social
  명에 콘서트 티켓 사기   대 징역  년,Social
      강동구 경유 타당성  재확인     국토부 건의,Social
  대 여성이 위험하다 코로나 유행 후 자살 충동 우울감 경험 최고치,Social
         압구정 롤스로이스 사망 사고  가해자  심 선고  ,Social
 굿클리닉 무릎 관절염   자가골수 줄기세포 주사 로 수술 최대한 늦춘다,Social
기획사 대표 수억원  꿀꺽  믿는 도끼에 발등 찍힌 이경규,Social
 굿모닝브리핑  소방관 체력시험 남녀 똑같이 본다    강인한 체력이 우선 ,Social
 빨간불 여성안전 이별통보에 전화 메시지 폭탄  스토킹  관대한 법원,Social
영화  친구  모티브 부산 라이벌 조폭들 장례식장 난투극 끝 무더기 징역형,Social
결혼 약속한 동거     차례 찔러 살해한   대    징역   년   유족  분노 ,Social
서초구 고시원 화재로   명 대피 강추위에 전국 곳곳 화재,Social
우리 아파트 안전할까  시멘트에 물 부으니 충격적 결과가  최병성 리포트 ,Social
최강 한파 폭설에 항공기 결항    편 바닷길도 막혀,Social
 대림동서 칼춤 출 것  일베에 올린   대  집유    반성 없다  항소,Social
문상 중이던 조폭  퍽  부산 장례식장서 패싸움한 조폭들  결국,Social
 콘서트 티켓 팔아요   천   만원  먹튀    대 실형,Social
첫 아이 낳으면 첫 달에만 최대    만원 지원하는 강남구,Social
 단독  등록금    만원 환불한다더니  강제출국  한신대 말로만 사과,Social
김수미 모자  우리가 피해자 법정에서 다툴 것 ,Social
 휴지 값 돌려내  영화관 화장실에 다른 층 손님들  우르르 ,Social
이경규 장도연  억대 출연료 못 받았다 기획사 대표   횡령 혐의  집유,Social
건보재정 적자 온다는데   년간 국고   조 덜 들어가 ,Social
  컷   영하   도  한파에도 붐비는 이곳,Social
사흘째      폭설 이 시각 광주,Social
도내 유일 충북대병원 신생아 중환자실 운영  비상 ,Social
환경부   국립공원 들고양이 불가피하면 안락사  규정 유지키로,Social
충북 예비후보   명 후원회 구성했지만 공천탈락 땐 자동해산,Social
단원고 스쿨닥터 김은지 원장  세월호   년     명의 기억    ,Social
나쁜 보도를 수사로 응징할 수 있다는 위험한 착각,Social
호남지방 대설특보 이 시각 광주,Social
 위안부는 자발적 매춘  류석춘 전 교수 재판  년 만에 결론,Social
 원심력 알려줄게    세 학생 빙빙 돌리다가 놓친 강사,Social
눈 풀린 채 비틀비틀 평창동서 집단 마약 남녀  명 송치,Social
 왜 우리 화장실을 쓰나       휴지값     만원 받아내고도 웃지 못했다,Social
  시간 전 국산이라더니  설 앞두고 원산지 주의보,Social
 이선균 협박   명 기소  수사정보 유출  강제수사,Social
공지영  내가 아무것도 모르고 떠들어  진중권에 뒤늦은 사과,Social
 남편 죽을 수도  신고에 가보니 비틀대는 남녀들 팔에 주사자국,Social
 마약 혐의  유아인측  우울증 오래 앓아 ,Social
일 시키고 공사비 못준다는 원청 건설업 분쟁조정금 급증,Social
부산 도심 들개 출몰 주의 얼굴 물려   바늘 꿰매기도,Social
조민  홍삼 전속모델 됐다  설 앞두고 한복 입은  깜짝 근황  공개,Social
이경규 장도연  억대 출연료 못받아 기획사 대표  횡령 ,Social
 알몸 남성 의 난동 집 안에서 발견된 것은 ,Social
 오늘 아침 신문  짝퉁 지뢰밭된  직구 삼성 이어폰 카카오 키링까지,Social
 결혼과 꿈은 후순위  비혼 자녀들이 떠맡는  노부모 돌봄 ,Social
 이선균 수사정보 유출 의혹  경찰 언론사 압수수색,Social
 나랑 친한   가 준 수표   억 가로챈   대 항소심도 징역형,Social
 건강플러스  가족의 미래까지 앗아가는  형 당뇨병이란 ,Social
 검은 머리 짐승은 거두는 게  양아버지 말 한마디에 격분 사건의재구성 ,Social
이선균 협박   억    만원 뜯은 전직 배우 유흥업소 여실장  재판행 ,Social
 설 앞두고 망연자실  평생 일군 일터 잿더미,Social
결혼 앞둔 여친    회 찔렀는데  우발적   유족  엄벌 촉구,Social
황색털에 검은 주둥이  얼굴 물렸다  부산 도심에 들개 출몰  발칵 ,Social
더욱 심화된 상급종합병원  빨대효과  작년  분기 급여비 점유율     육박  역대 최고 ,Social
설 앞두고  망연자실   특별재난지역 검토 ,Social
서울시의회 파격 저출생 대책    취지 공감  면밀한 검토 필요 ,Social
광주 전남 소재 건설사들 잇따라  법정관리  신청,Social
 대체 왜 이런걸     녹말 이쑤시개 튀김  먹방 유행  무해할까 ,Social
서울 은평구 아파트 화재 주민   여 명 대피,Social
 예능인 출연료 미지급  논란 소속사 대표  횡령 혐의로 집유,Social
거센 눈보라에 무더기 결항 뱃길도 막혀,Social
 대북송금 혐의  김성태  년 만에 보석 석방,Social
경찰   이선균 수사 정보 유출  의혹 인천청 압수수색,Social
 집도  일터도 추워   피할 수 없는  강추위와 사투 벌이는 서민들  뉴스 투데이 ,Social
 전문의 칼럼  아이고  무릎아  추운 날씨에 붓고 아픈 무릎,Social
사흘째      폭설 이 시각 광주,Social
수형자 사회 복귀 돕는다는 가족접견  정작 부부끼리는 안 된다 ,Social
 위안부는 자발적 매춘  류석춘 재판  년만에 결론,Social
 머리카락 잘라라  비난받은 조규성  장발 이유가,Social
인구 줄테니 의대증원 안된다       년 입원일     늘어날 것 ,Social
전라 제주 시간당       눈소식  아침 영하   도 오늘날씨 ,Social
 월  일이후 입국 외국인부터  개월이상 거주해야 피부양자 자격,Social
 박근혜 정부 문화계 블랙리스트  김기춘  파기환송심 오늘 선고,Social
 단독  엔화 바꿔줄게요  당근마켓 거래 후 내 계좌가 막혔다,Social
올림픽대로서 시속     로 느릿느릿    길막  유튜버 논란,Social
 파주 집창촌 폐쇄 전쟁  건축법 위반 강제철거    여 곳 불 꺼졌다 ,Social
 엉덩이 움켜쥔   쌤  성추행 아니라니   회원 분통,Social
 준비됐니   버스 기사가 찍은  세 소년 달리기 영상 화제,Social
 대법관 추천  합리 공정성  볼 것 사법신뢰 찾아야 ,Social
 단독 서울 공립 유 초등교사 명퇴  년간  최대  교장  년새  배,Social
잘나가던 신촌이 어쩌다    년 터줏대감  롯데리아도 떠났다,Social
기술유출범 잡는 경찰 승진은 하늘의 별따기,Social
주호민 부부  아동학대 로 신고 당했다  주씨 측  모든 주장은 허위사실  반박,Social
대북송금 혐의 김성태 보석 석방  재판서 드러날 것 ,Social
김건희  디올백  수수 의혹부터     극적  봉합 까지 타임라인 ,Social
 제보는   요청해도 촬영 안 하면  무용지물     현실 맞게 바뀌어야 ,Social
서울에  낑겨  살기  우리 탓인가요 꼬다리 ,Social
 법원이 기술간첩 키우는 셈  기밀 빼간 그놈들  무슨 판결 받았나,Social
 정치인보다 유튜버 더 믿음직  중 고등학생들의 이유있는 불신,Social
합격하면 수강료 환급 여대는 왜 안되나요 ,Social
 장례식장 난투극  신  세기파 칠성파 줄줄이 징역형,Social
기술유출 양형 강화됐지만  판결 나와봐야 알죠  시큰둥한 이유,Social
도대체 교통카드가 몇 개냐  기후동행카드 판매 첫 날  시민들 만나보니  데일리안이 간다    ,Social
 비행기 못떠요  폭설 덮친 제주공항    편 결항   만여명 발동동,Social
광주 중앙공원 지구 선분양 검증 시동  사업 급물살 ,Social
 이선균 마약 수사 유출  경찰 언론사 압수수색,Social
이재명 건강 악화로  대장동 재판  퇴정  심기 불편한    이런 상황 재발 않길 ,Social
 준비됐니   버스 기사가 찍은  세 소년 달리기 영상 화제,Social
 대법관 추천  합리 공정성  볼 것 사법신뢰 찾아야 ,Social
 단독 서울 공립 유 초등교사 명퇴  년간  최대  교장  년새  배,Social
잘나가던 신촌이 어쩌다    년 터줏대감  롯데리아도 떠났다,Social
기술유출범 잡는 경찰 승진은 하늘의 별따기,Social
주호민 부부  아동학대 로 신고 당했다  주씨 측  모든 주장은 허위사실  반박,Social
대북송금 혐의 김성태 보석 석방  재판서 드러날 것 ,Social
김건희  디올백  수수 의혹부터     극적  봉합 까지 타임라인 ,Social
 제보는   요청해도 촬영 안 하면  무용지물     현실 맞게 바뀌어야 ,Social
서울에  낑겨  살기  우리 탓인가요 꼬다리 ,Social
 법원이 기술간첩 키우는 셈  기밀 빼간 그놈들  무슨 판결 받았나,Social
 정치인보다 유튜버 더 믿음직  중 고등학생들의 이유있는 불신,Social
합격하면 수강료 환급 여대는 왜 안되나요 ,Social
 장례식장 난투극  신  세기파 칠성파 줄줄이 징역형,Social
기술유출 양형 강화됐지만  판결 나와봐야 알죠  시큰둥한 이유,Social
도대체 교통카드가 몇 개냐  기후동행카드 판매 첫 날  시민들 만나보니  데일리안이 간다    ,Social
 비행기 못떠요  폭설 덮친 제주공항    편 결항   만여명 발동동,Social
광주 중앙공원 지구 선분양 검증 시동  사업 급물살 ,Social
 이선균 마약 수사 유출  경찰 언론사 압수수색,Social
비대면 진료 확대 한 달   아픈 아이 편히 진료      처방약 찾아 삼만리 ,Social
 돼지머리  무혐의에 공사 중단까지   이슬람 사원 안갯속,Social
 매일 세 차례나 아이 학교 찾아가  주사 놓는 부모 가슴 피멍 듭니다 ,Social
 단독  유령법인 세워    채 갭투자한 부부  결국 검찰행,Social
법무 장관 후보 지명된 박성재 법무 검찰 조직 다잡기 나서나,Social
서울  영하   도  출근길 제주     폭설 오늘날씨 ,Social
이발하러 가도  예약 손님만 받아요  헛걸음하는 어르신들,Social
    원만     계좌번호 올리는  온라인 거지  비난 쇄도,Social
전청조  혐의 부인한 적 없어     피해 회복도 안됐는데 그런 말 한다고 상처 아물까 ,Social
유부남 집 장롱에 숨은   귀가한 아내와 몸싸움 ,Social
 단독 재범 우려 관리대상     명  거처만 옮겨도 감시망 피한다,Social
 핫코너  이젠 졸업식 때나 입는 교복,Social
 말로만 듣던 한국 김  해외바이어 줄섰다,Social
우크라 출신    미인대회 우승  일본내 논란,Social
바지 두개 껴입고 청소   영하   도  언 손으로 새벽 여는 사람들,Social
막장 전북교육감 사건  폭행 위증에 판사 논란까지  반전의 연속 ,Social
 베링해 한파  서울 체감 영하     도  제주엔  만여명 발 묶여,Social
체감        수도관 터졌어요  눈뜨자 난리  뜨거운 물 부으면 안돼 ,Social
 헬스트레이너가 엉덩이 주물러 성추행 신고했지만  무혐의  ,Social
도심서 야생 들개가 얼굴 물려 응급 수술,Social
 압구정 롤스로이스 뺑소니  사건 가해자 오늘  심 선고,Social
 이선균 수사정보 유출 의혹  인천경찰   언론사 압수수색,Social
눈보라 몰아친 제주  만 명 발 묶였다,Social
  대   고 인 척 미성년자 만나 룸카페서 성범죄  가족들이 현장 잡았다,Social
푸바오  대한항공 타고   갈줄 알았는데  에어차이나  이용 왜 ,Social
오토바이 타고 가던 중 신호위반 차에 치여 다리 절단하게 된 사연,Social
 청주시장  시립무용단 객원안무자 낙점은 월권 ,Social
룸카페서   대에게 성범죄한   대 가족들이 현장 잡았다,Social
 현장잇슈  갤럭시    통역기 들고 명동 거리 나갔습니다  꽤 쓸 만한데 이거  ,Social
 날 무시해   아내 살해 뒤 성폭행 현장으로 둔갑시켰다  그해 오늘 ,Social
 오징어 틈새로 흰색가루가  태국서 필로폰 밀수한   대 실형,Social
한달도 안돼 또 가스누출 평창      폭발사고  동일업체,Social
 빙하기 왔나  수도 얼어 터지고 차량방전 긴급출동 속출,Social
 오래된 미래 강원 노포 탐방      철원 길목해물칼국수,Social
 여기가 한국  무서워요  대학가 점령한 중국식 상점,Social
청소년 형 당뇨 가족들  높은 의료비에 의사노릇까지,Social
숨진 채 발견된   대 간호사  고위험 약물  주사기 발견,Social
한복 차려 입은 조민   저 홍삼 모델 됐어요 ,Social
종합병원 간호사 숨진 채 발견 현장엔 약물주사기 ,Social
유령노조 삭제하니   년 만에 조합원 첫 감소,Social
 민원사주   개인정보유출  경찰 수사 속도차   균형 깨졌다 ,Social
구청 홍보영상 맞아  서울에도  충주맨  있다,Social
 결혼과 이혼  아이 앞에서 이혼 요구한 남편  아이는 남몰래  훌쩍 ,Social
 둘째 아이 가질 때가 고비 일곱째 낳은 지금 더 행복 ,Social
 샌드위치 패널  건물  피해 커져 상인들  설 앞두고 날벼락 ,Social
 기가   중앙선 넘나드는 음주운전 차량   년 전 죽은 사람 ,Social
 게 껍데기야   양념치킨 속  수상한 이물질   점주는 문자 읽고 무시 ,Social
일년에 열 번도 안 입고 버려지는 교복 자원 낭비,Social
     는 저희 회사와 어울리지 않네요   차라리 관상 봐라  구직자 분통,Social
 여성만 달성 불가능한 기준 제시는 승진 차별 ,Social
 신의 구원 받아야  중증 장애인 동생 치료 거부하고 방치한 누나,Social
결혼 앞둔 여친    회 찔러 살해 유족  징역   년에 분노,Social
윤 대통령  여권 방심위원만 위촉  민주당  대통령 고발 검토 ,Social
 대학 대신 공무원 될래요     공무원 떠난 빈자리    대  잘파 희망 이 채운다,Social
보석 석방된 쌍방울 김성태  성실히 재판 임할 것 ,Social
언론사 주    일제  기자에겐 그림의 떡 ,Social
먹튀사건의 지능화  계산 안하고 도망  강사 아닌  노숙자 였다,Social
기자협회  이달의 기자상  어느덧    회,Social
 기후동행카드  판매 첫 날부터 인기 누가 쓰면 이득 ,Social
 단독   청량리 재개발 비리  동대문구청 압수수색    공무원 불법 특혜 분양 ,Social
 년 만에 석방된 쌍방울 김성태    재판에서 다 드러날 것 ,Social
아시아나  기내식 대금 소송 항소 취하  소송전  년 만에 일단락,Social
비언론계 전진배치  포털 제휴 지각변동 오나,Social
    중 엉덩이를 움켜쥐었다  헬스장 성추행 논란  다른 트레이너 판단은,Social
    희망퇴직 신청  목표치     남짓,Social
국민의힘  청주 청원 흥덕 서원 전략공천 가능,Social
달아오르는 총선의 계절   정치 라이브 가 겨울잠 깨운다,Social
북극발  최강 한파  한랭질환 사망 동파 강풍 피해 속출,Social
생필품 중고로 사는 친구 자신이 새것 살 때마다  가스라이팅  사연은 ,Social
화재 감지됐어도 속절없이  활활  점포    곳 전소,Social
최대      더 온다 밤사이가 폭설 고비,Social
새해맞이 단식  주 해보니 눈이 밥알처럼 내리는구나,Social
유부 품은 빨간색  서울식 추탕   먹다보면 등줄기에 땀이 쫙,Social
 설에 팔 조기 문어   배 들여놨는데     서천 시장 상인들 망연자실,Social
올림픽대로에서        느림보 주행  안전운전일 뿐  해명,Social
고속도로에서 얼음판 날아와   앞유리  와장창  어떤 상황인지 보니,Social
친형 살해   년 만에  자수  징역   년에 검찰 피고인 쌍방 항소,Social
 이젠 안녕  네살 된 푸바오  월 초   돌아간다,Social
조국  한동훈 딸 의혹  내 딸처럼 수사해야 공정한 것 ,Social
 이선균 수사정보 유출 의혹  인천청 압수수색   언론사도 포함,Social
 엉덩이 움켜쥐고 주물렀다  헬스 트레이너  성추행  신고했지만  무혐의   왜 ,Social
아시아나  기내식 대금 소송 항소 취하  소송전  년 만에 일단락,Social
비언론계 전진배치  포털 제휴 지각변동 오나,Social
    중 엉덩이를 움켜쥐었다  헬스장 성추행 논란  다른 트레이너 판단은,Social
    희망퇴직 신청  목표치     남짓,Social
국민의힘  청주 청원 흥덕 서원 전략공천 가능,Social
달아오르는 총선의 계절   정치 라이브 가 겨울잠 깨운다,Social
북극발  최강 한파  한랭질환 사망 동파 강풍 피해 속출,Social
생필품 중고로 사는 친구 자신이 새것 살 때마다  가스라이팅  사연은 ,Social
화재 감지됐어도 속절없이  활활  점포    곳 전소,Social
최대      더 온다 밤사이가 폭설 고비,Social
새해맞이 단식  주 해보니 눈이 밥알처럼 내리는구나,Social
유부 품은 빨간색  서울식 추탕   먹다보면 등줄기에 땀이 쫙,Social
 설에 팔 조기 문어   배 들여놨는데     서천 시장 상인들 망연자실,Social
   수첩  대통령과 거부권  사라지는 협치,Social
폭설 강풍에 제주 공항 무더기 결항    만여 명 발 묶여,Social
 윤정호의 오늘  충북대의 어머니,Social
일 년에 열 번도 안 입고 버려지는 교복 자원 낭비,Social
 설 앞두고 망연자실  평생 일군 일터 잿더미,Social
남편 추락사 현장 찾아온 베트남 아내 원인 규명 사과 요구,Social
무인매장서 바지 내리더니     로 지켜본 점주의 분노,Social
육아 도맡아하는데 출산휴가 쓴 아내  남편  돈타령  때문에 고충 토로한 사연,Social
애써 따낸 국고 보조금  매년 수백 억 반납 ,Social
충북 전역 한파특보 강추위 절정,Social
 밀린 기내식 대금 소송   년 만에 종결    억 물어야,Social
       모바일 상품권 쓰면 상차림비 추가  소비자 골탕먹이는 프랜차이즈,Social
    재난안전지도      이 시각 전북 대설 상황은 ,Social
 부르는 게 값  동물병원 진료비 공개 소비자 환영 수의사 반발,Social
 대장동 재판  출석한 이재명 몸 상태 악화로 오후 퇴정,Social
보석 석방된 김성태  이재명 연관성 묻자  재판서 드러날 것 ,Social
   원이라도 벌어야  이 추위에도 폐지 줍는 노인들,Social
초등학교에서 흡연 유해성 배워 온 딸  아빠 담배 끊어내기 위해  단식투쟁  선언,Social
제주공항 결항 속출   만명 발 묶여   여객선   척도 스톱,Social
최대      더 온다 밤사이가 폭설 고비,Social
혹한 날씨에도 밤새 염원한 이태원 특별법,Social
잿더미로 변한 서천시장 상인들  곧 설인데 막막 ,Social
서울 한복판서  집단 마약   철제 상자 엔 필로폰 주사기,Social
 대북송금  혐의 김성태 석방  이재명 질문엔  재판서 드러날 것 ,Social
폭설 강풍에 막힌 제주 하늘길    여 편 무더기 결항,Social
북극 한파 물러나자 대륙 한파 덮쳤다    내일도 출근길 영하   도,Social
번호판 타고 운전자 누군지 몰라  교각 충돌 뒤 불길 휩싸인 전기차,Social
 설 앞두고 망연자실  평생 일군 일터 잿더미,Social
서울 모든 저출생 정책서 소득기준 폐지  시의회  파격 제안,Social
화재 감지됐어도 속절없이  활활  점포    곳 전소,Social
법무장관에  특수통  박성재 김건희 수사 통제용 ,Social
 쪼인트 폭행  조합원 복직 요구   울산 화물연대 운송거부에   억 손해,Social
경남 공무원노조    시간 노동에   만원  선거사무 강제 동원 그만 ,Social
활주로 폐쇄까지    여 편 결항   발 묶인 제주,Social
얼굴 물려   바늘 꿰맸다 부산 한복판 야생 들개 어슬렁,Social
이정섭 검사 비위 의혹 폭로한 처남댁 강미정 휴대전화 포렌식 자료 제출,Social
마늘 먹는 푸  굴 따는 모아나  롯데마트의 콜라보  본전 뽑기   미드나잇 이슈 ,Social
식당 찾은 손님  외부에서 사온 오렌지 껍질 알바생에게 까달라고 부탁한 사연,Social
방심위  방송소위서     의견진술 결정,Social
내복  겹  방석  개  양초 켜 놓고 장사   추위 속 일하는 사람들,Social
 단독  청도 특혜 의혹 조형물   기증 작품 설치부터 의혹,Social
수학 대회서 오픈   제쳤다     국가대표       라운지 ,Social
쌍방울 김성태  년 만에 보석석방  성실히 재판에 임하겠다 ,Social
 예비신부 살해  징역   년 유족    분 만에 자수  계획적 ,Social
    만 달러 대북송금 혐의  김성태 전 쌍방울 회장 보석 석방,Social
이철규  명품백 실체는  몰카 공작  반환하면 국고 횡령 ,Social
  대 베트남 가장의 무너진 코리안드림   반년만에 입국한 유족은 망연자실,Social
 정부 단통법 폐지  우리는  호갱 이 되지 않을 수 있을까,Social
 남자 우대 아냐  강인한 체력  소방관 필수요건  소방공무원 체력 시험 남녀 동일 기준 적용,Social
음료 서비스 줬더니  애 당뇨 걸려  제로 콜라 없어   소리 지른 손님,Social
결혼 약속한 여자친구 흉기로    회 찔러 살해,Social
 단독   배달의민족  배달 취소 피해 업주에 전가  알고리즘 변경 논란,Social
 년만에 보석 석방된 쌍방울 김성태  성실히 재판에 임할 것 ,Social
