titles,category
  연승  웃을 수만 없는 트럼프  낙태권 중도층서 약점 ,World
가자 전후구상   국가 해법    이스라엘 커지는 파열음,World
러시아 직항 노선   개국으로 늘어,World
이스라엘 하마스  휴전안 이견 좁혔지만 최종 합의는 안갯속,World
중국     간부  테슬라 심각한 도전에 직면할 것 ,World
트럼프  미국에 공장 지어라    긴장하는 한국 경제   녹취록 ,World
미영  예멘 후티 반군 또 공습   도  군사력 지원 ,World
독주 채비 마친 바이든 트럼프  재대결 확실시,World
 대만 방어  글쎄   트럼프 재집권 가능성에 대만 긴장,World
 올해 공화는 트럼프의 당  뉴햄프셔서 재입증   더힐  헤일리 하차 촉구,World
트럼프  파죽의  연승 바이든과 리턴매치  성큼 ,World
알래스카는 러시아땅  미국  돌려받는 일 없을 것  일축,World
온통 분홍색 방  교복으로 시선 끌어라      광고에  역겹다  비판,World
후보 등록도 안 한 바이든  어떻게 승리했나   깨알지식  ,World
경선  연승 트럼프  본선티켓 예약 버튼 눌렀다,World
홍해 사태에 중동  에너지   운반 비용 열흘 새      넘게 급등,World
  연패  헤일리   월  슈퍼 화요일 서 실낱같은 반전 노린다,World
테슬라 올 들어     급락  시총    조 증발,World
 이 하마스  한달 휴전과 인질 수감자 교환 원칙적 합의 ,World
러시아 가는 북한인 급증 북중접경엔 양국 오가는 트럭 늘어서 종합 ,World
             밑 빠진 독  그레이스케일 펀드에 비트코인  현물     출시 후     하락,World
튀르키예  스웨덴 나토가입 비준  친러  헝가리만 남았다,World
  포함   개국      후티  차공습  지지  공동성명 발표,World
대만인      나는 중국인 아닌 대만인    만 중국인으로 여겨,World
 공화 다음 네바다 코커스 투표용지엔 헤일리 이름이 없다 왜 ,World
 덜 떨어진  바이든     최대 위험  트럼프 대선 첫 재대결 확정,World
 자민 파벌  모두 해산  불투명  기시다 정권 운영 더 험난해질 듯 ,World
 부동산  도 도와주네    골든글로브 품은 엠마 스톤    저택 팔아   억 차익,World
 연승으로  대세론  굳힌 트럼프     경선 사실상 끝났다 ,World
몸집 키우는 나토 러시아와 냉전 체제 회귀에 긴장 고조,World
 올댓차이나     헤지펀드에 주가선물 공매도 자제 요청,World
중국  타이완 단교  나우루와 국교 회복,World
 살고 싶나  트럼프 시즌  올라타라  공수 바뀐  리턴매치  확실시,World
미국  또 후티 맹폭  대함미사일  기 파괴 ,World
 친중  몰디브   조사선 정박 허용   외교 갈등  빨간불 ,World
내일 새벽  시 테슬라 실적 발표  주당순익       감소 전망,World
러시아 대공습에    명 사상   우크라이나 방공망 고갈 직전 ,World
      아시아 기업들이 앞다퉈   워싱턴에 사무실 내는 이유,World
도요타 시총    조원    사상최고치 버블기     기록   년만에 경신,World
 장사 잘되는데       대 버거  인앤아웃  첫 폐점 나온 충격 이유,World
 지구 멸망까지 단   초  아인슈타인의 지구종말시계  여전히  매우 불안정 ,World
 트럼프 대항마  헤일리  고향서 경선 역전 노린다,World
트럼프  뉴햄프셔 경선도 승리    헤일리  경기 끝나려면 멀었다  종합 ,World
    대만 단교  나우루와 국교회복  대만 수교국들 바로잡아야 ,World
 여소야대  대만 입법원장 선거 앞두고 각당 수싸움,World
 자막뉴스   파죽지세  트럼프 대세론 굳혔다   바이든과의 재대결 조기 확정 가능성,World
헤일리 돌풍 잠재운 트럼프  세 가지 관전포인트는  뉴햄프셔 경선 ,World
필리핀 국방  남중국해 자원개발 방해에 무력동원 시사,World
할리우드 영화 외면하는 중국  더 강한 중국 이 대세,World
등록도 안한 바이든  뉴햄프셔 경선 압승  이름 써준 분 감사 ,World
 지구 멸망까지   초 남았다  위험 요인  이것들  때문,World
 경기 끝나려면 멀었다  사퇴 압박 거부한 헤일리 완주 가능할까   공화 경선 ,World
 더뉴스  트럼프 바이든  뉴햄프셔 경선 각각 승리   재대결 성사될 듯,World
   절대 못 이긴다 더니 정권 못잡고 길 잃은 대만 국민당,World
 미국과 잘 풀어야 하는데   호전적  북 러 밀착에 심기불편  ,World
     실시간뉴스  트럼프 대세 굳혀   바이든도 첫 경선 압승,World
투표소 가보니  민주당원 견제 투표 에도  샤이 트럼프  막강,World
 반도체 사업 다 가져가  트럼프  타이완 방어에 또 부정적 답변,World
 친중  몰디브   조사선 정박 허용 인도와 외교갈등 심화할 듯,World
 르포 공화당도  무당층도  경선 투표 열기 후끈  뉴햄프셔 투표소에서 읽은 바람,World
  연초부터 잇따르는 자연재해에 몸살,World
비트코인 가격  현물     승인 후     이상 급락,World
미국  이라크 내 친이란 민병대에  보복 공습 ,World
인앤아웃버거  호 폐점 나왔다 주차장에 들끓는 이것 때문,World
바이든 트럼프 다시 맞붙는다   대선  예측 결과는 ,World
 삼성 러시아 공장  현지업체가 임대할 수도  우크라 사태 여파,World
트럼프  중국  대만 침공    대만에 반도체 사업 뺏겨 ,World
 자민당 파벌 해체 유야무야     돈 인사권 없앤  정책집단  전환 추진,World
 이스라엘 하마스  한달 휴전 합의에도 시행 보류 ,World
 나우루처럼 단교할라  대만  태평양섬나라 투발루 총선에 촉각,World
   이라크에서 친이란 조직 보복 공격   벌써  번째,World
대만 국방장관    봉쇄에 대비책 있다 모든 상황 가정 ,World
 부통령 후보 급구  트럼프  팀 스콧  내가 찾는 사람 ,World
미 공화 뉴햄프셔 경선서 트럼프 승리 확실시,World
바이든 트럼프 첫 프라이머리 나란히 승리 재대결 성큼      대선 ,World
유엔 사무총장  이스라엘의  두국가 해법  거부  용납 불가 ,World
바이든 트럼프 재대결 조기 확정되나 뉴햄프셔 경선 각각 승리,World
  과 갈등  필리핀 마르코스  대만은 중국 일부  유화 신호,World
        만원짜리 디올백    집권여당 뒤흔들다 ,World
 뉴스앤이슈    트럼프  대선 경선   연승    바이든도 뉴햄프셔 경선 승리,World
  공화경선  헤일리  투표 종료   분 만에 패배 인정 사퇴 대신 출정식,World
미국 언론  트럼프 승리 확실  헤일리  경선 안 끝났다 ,World
 이변 없었다   공화 트럼프 민주 바이든 승리 헤일리는 선전 종합 ,World
비행 중 동체 파손 사고 보잉 당국 조사 속 경영진 교체 요구까지,World
미국      김건희     달러 디올백  보도  한국 여당 뒤흔들다 ,World
우크라에 떨어진 러 미사일서 한글     발견  북한제 동원 ,World
 금리 인하  기대감에 고심 커진 라가르드 조은아의 유로노믹스 ,World
 바이든은 학살자  이스라엘 제어 못하자 유세장서 비난 이어져,World
 주요국 중 미일만 중국 중간재 수입비중 축소 디커플링 확인 ,World
트럼프   연승 새역사   대선후보  고지 가 보인다,World
 영상  원샷 원킬  우크라 저격수들  하룻밤 새 러    명 사살 포착 ,World
혹한에 기차 밖 내던져져 숨진 고양이에 러시아 들썩,World
나토 사무총장  임박한 러시아  위협 없다  안보 불안 일축,World
 영상  로켓 맞고 건물 붕괴  이스라엘군   명 몰사 하마스 영상 공개,World
튀르키예 비준   스웨덴 나토가입  헝가리만 남았다,World
러  키이우 하르키우  미사일 공격  우크라 약점 찾으려  릴레이 공습 ,World
트럼프 바이든 뉴햄프셔 경선 각각 승리 재대결 조기 확정될듯 종합 ,World
일본  수능  한국어 시험에 몇 명이나 응시할까,World
 풍계리 핵실험장 초기 위성사진 보니    년전 착공 추정 ,World
 연승 행진  트럼프  대세론 굳히나,World
우주의 핫플된  이곳  좀 사는 나라들 벌써 다 찜했는데 한국은,World
 그리 미지근해서 표 얻겠나     중산층 동네 서도 헤일리 완패,World
 조용히 사라진 줄 알았나      억  한 방  투자나선 이 남자,World
 공화 경선  패  헤일리  끝나려면 멀었다  사퇴론 일축      대선 ,World
러시아 가는 북한인 급증  북러밀착 속 외화벌이 의심도 ,World
디샌티스 뒤끝   언론이 트럼프 승리 기정사실화 경선 악영향 ,World
세계 속 미국의 위치는  트럼프 헤일리  외교 입장 대결  뉴햄프셔 경선 ,World
 월 마이너스 금리해제 준비    금융당국  금리 인상  대비 점검 착수,World
     트럼프 뉴햄프셔 경선 승리 전망  이변 없었다  종합       대선 ,World
뉴햄프셔  공화 트럼프 민주 바이든 승리 재대결 조기확정될듯,World
 정책 집단 으로 명칭 바꿔 자민당 계파 존속  기시다 개혁안 한계,World
트럼프 경선 승리 바라는 민주당   부동층 등 표심 결집 ,World
 속보  뉴햄프셔  공화 트럼프 민주 바이든 승리 재대결 조기확정될 듯,World
푸틴   월 이후 방북할 듯      북러 밀착 우려 ,World
이변은 없었다     뉴햄프셔 공화 경선  트럼프 승리 ,World
다자대결  트럼프에 더 밀리는 바이든,World
세계는 벌써  트럼프 시즌   시나리오 준비,World
지구 종말 시계  종말까지   초   핵 위협    등이 변수,World
우크라 땅에 떨어진 러 미사일  열어보니 한글    이 ,World
부끄러운 역사 지우기 나선 일본  강제동원 조선인 추도비  철거,World
구찌  뉴욕서  조원대 건물 매입 대기업  건물주 되기  열풍,World
트럼프    뉴햄프셔주 경선 승리 큰 차이 내진 못해,World
러시아 가는 북한인 급증  북러밀착 속 외화벌이 재개될 수도 ,World
선거의 해에 기승 부리는     가짜 목소리   나 바이든인데 ,World
 뉴스포커스  뉴햄프셔 경선 투표 종료  트럼프 대세론  굳힐까,World
중화권 시가총액   년간  천조원  증발   영국    의  배,World
스웨덴 나토 가입 초읽기  친러  헝가리만 남았다,World
 자동차   서 고전 점유율  년 연속 하락    까지 추락,World
 칼럼  국보법 들어  민주국가    그다지 자유주의적이진 않아 ,World
다시 확인된 트럼프 대세론 뉴햄프셔서도 승리 확실시 상보 ,World
      대선 트럼프  뉴햄프셔 경선 승리  연승  대세  확인 종합 ,World
 애플카  출시 또 미뤘다  테슬라 모방 제품  내부서도  시끌 ,World
트럼프   공화당  차전 뉴햄프셔 승리   헤일리  경선 안 끝나 ,World
알리바바 주식 매각한다던 마윈 창업자     억원어치 사들였다,World
중국 당국 나선다   증시 급락하자 대규모 자금 투입 예고  지금이뉴스 ,World
대출 손실 급증에   은행 채권 사들이는 사모 헤지펀드,World
    뉴햄프셔 경선에서도  트럼프 가 승리했다 ,World
 수낵 총리 사퇴해야  난민 르완다 송환에   보수당 내분,World
아이들이 쑥 집어넣자  펑 하고 날아간 맨홀뚜껑 비상걸린  ,World
지구 종말까지    초  남았다   핵위협  온난화가 요인 ,World
 애플  자율주행 전기차 출시 또 연기  빨라야     년 ,World
 포착  우크라 병사  중기관총으로 러 순항미사일 격추,World
트럼프  대세론  굳히나  뉴햄프셔 프라이머리 승리,World
   이라크 내 친이란 민병대 공습  우리군 공격 대응 조치  이 팔 전쟁 ,World
트럼프 독주 이대로 쭉  확산하는  대세론 ,World
 바이든   민주 뉴햄프셔 비공식 경선 승리     ,World
      대선     트럼프  뉴햄프셔 경선 승리   대세론  입증,World
 우크라에 꽂힌 러 미사일     한글 확인 북한제 증거   포착 ,World
 미쳤다  아카데미에 감사  한국계  감독 부친  알고 보니,World
규모     강진  노토반도 핵심 도로 복구에 수년 걸릴 듯,World
 이   하마스  한 달 휴전과 인질   수감자 교환에 원칙적 합의 ,World
왕이 될 수없는    외동딸 아이코 공주  첫 직장은 적십자,World
     트럼프  뉴햄프셔 승리      개표 상황    차 헤일리에 우세  보 ,World
투자자들  차이나런  중화권 증시 시총     조원 증발,World
 둠스데이  종말까지   초   전쟁  기후  그리고 마지막 이유 ,World
 속보    뉴햄프셔 공화 경선  트럼프 승리 ,World
 속보   트럼프   뉴햄프셔 경선도 이겼다    대세론 쐐기,World
     후티  큰 타격 입어 상선 공격시 즉각 대응할 것  종합 ,World
미 뉴햄프셔 공화 경선  트럼프 승리  연승으로 대세론 확인,World
  타임스 보도인력        명 해고     년 역사상 최대 감원,World
러 미사일에서 한글     나왔다     미사일이란 단서 ,World
미 국방부  미 지원 중단 따라 우크라 전선 탄약 고갈 시작 ,World
오를 줄 알았는데 비트코인  현물     출시 후     급락,World
  공화 뉴햄프셔 경선도 트럼프 승리   헤일리  사퇴 안해 ,World
인니 대선 후보 모두 남성인데  숨은 실세는  여성 킹메이커 ,World
멕시코 최대갑부 슬림   년간 자산    증가     조원 ,World
엔화    장기금리 상승에  달러    엔대 전반 하락 출발,World
미 공화 뉴햄프셔 경선 개표 시작 헤일리 초반 기세 우세,World
트럼프  바이든과 대결서 헤일리보다 내가 낫다  대세론 굳히기,World
     후티 추가공습   개국 지지받았다    도 포함,World
마윈  알리바바 지분    억원 규모 매입  주가    급등,World
  포함   개국    의 후티 재공습에  번째 지지 성명,World
        만원짜리 디올백    여당을 뒤흔들다   김건희 논란  대서특필,World
넷플릭스        년 중계권에  조  천억 투입    역대 최고 금액 ,World
북극 한파에 뒤덮인 동북아 제주도 이어 일본도 폭설,World
홍콩 민사 소송    본토서 판결 집행 자산 엑소더스 부르나,World
 이 하마스  한달 휴전과 인질 수감자 교환에 원칙적 합의 ,World
파벌은 인사추천 없는  정책집단  존속 의원들 명절  떡값  폐지,World
 러시아  사용 신호 지구종말시계  남은 시간은   초 ,World
막 오른 뉴햄프셔 경선 한국 시간 오늘 낮 판가름,World
 인터뷰   트럼프  감옥 가면  그래도 대통령 될 수 있나  ,World
한국 등   개국  미 영 후티 추가공습 지지 성명,World
 뉴스라이더  트럼프  쐐기     헤일리  반격    뉴햄프셔 경선 결과는 ,World
 한국 포함    개국  미 영 후티 추가공습 지지 성명,World
  대선 앞두고     등장한 트럼프 ,World
    예멘 후티 반군 추가 공습에  한국 등   개국 지지 성명,World
막오른 뉴햄프셔 경선 한국 시간 오늘낮 판가름,World
 눈사람 판매합니다  눈 내리면 등장하는   노점상 화제  여기는 중국 ,World
야심작 자율주행 전기차 애플카 출시 또 지연   빨라야     년 ,World
러시아가 우크라에 쏜 미사일에 웬 한글이    표기     미사일 사용 명백 ,World
       러 스파이 모집  영상 공개 우크라전쟁 둘러싸고 신경전,World
이스라엘 헤즈볼라 전면전 발발하나,World
러  우크라이나 키이우 대공습   명 사망,World
  개국  미 영 후티 추가공습 지지 성명 한국도 포함,World
우크라에 쏜 러 미사일에  한글  나왔다    미사일 단서 ,World
트럼프  압승   헤일리  접전   공화 뉴햄프셔 경선 최대 관전포인트,World
우크라에 쏜 러 미사일에 새겨진  한글     미사일 사용 ,World
 공화 경선 분수령 뉴햄프셔  트럼프 쐐기    헤일리 대반전 ,World
트럼프 독주냐  헤일리 추격이냐 뉴햄프셔 경선 곧 종료,World
중대 분수령 뉴햄프셔 경선 시동 트럼프 독주 굳어지나,World
 멸망까지   초 남았다  지구종말시계가 경고하는 위험들은 ,World
 자막뉴스  몰아치는 역습   무기 총동원한 러시아의  파죽지세 ,World
미군  이라크 내 친이란 민병대 거점 공격,World
보잉 압박 수위 높인 유나이티드항공 실적호조에 주가    급등,World
   이라크 내 친이란 민병대 공습  미군 공격에 직접적 대응 ,World
 멸망까지   초    아인슈타인이 만든 지구종말시계      년에 경고,World
    조원 실화   빈부격차 극심  이 나라 서  탑  부자  자산은  년간     ,World
도요타    년 만에  기업 시총 기록 경신  버블기     넘었다,World
 이 팔  한달 휴전에 원칙적 동의  영구 휴전  조건엔 이견  로이터,World
 트럼프 고령  꼬집는 헤일리측  나이 들어 대화 파악 힘든 듯  뉴햄프셔 경선 ,World
헤일리  뉴햄프셔에서 트럼프 압승해도 경선사퇴 안해 ,World
   대만 침공시 개입   질문에 트럼프  대만이   반도체 사업 다 가져갔다 ,World
 아르헨 르포  대중교통요금      급등 예고에도  그 정도면  ,World
러시아  우크라에 또 대규모 공습  최소   명 사망    명 부상 ,World
스웨덴  나토 가입  부 능선 넘었다  친러  헝가리만 남아,World
이스라엘에게 끌려다니는 바이든   치명적 약점  보인 초강대국   녹취록 ,World
하수구 안에 던진 폭죽  펑  맨홀 뚜껑 날려버린   아이들,World
한미 등   개국  후티 반군 규탄  미 영 공습 지지 성명,World
하락세  증시   증시와 시총차   조달러 역대 최대,World
 테무 쉬인  중국업체에 뿔난 멕시코 유통업계  꼼수 면세 의심 ,World
 테무 쉬인  중국업체에 뿔난 멕시코 유통업계  꼼수 면세 의심 ,World
러 매체  삼성 러시아 공장  현지업체가 임대나 매각할 수도 ,World
 트럼프  다자대결시 바이든에    포인트 앞서 ,World
일본서 정전으로  신칸센  정지 복구 과정서 폭발 사고,World
뉴햄프셔 경선 시작 트럼프 공화당 후보 확정 주목,World
 테무 쉬인   업체에 뿔난 멕시코 유통업계  꼼수 면세 의심 ,World
멕시코 억만장자 넘버     빛의 속도 로 자산 늘었다,World
푸틴   월 대선 이후 방북할듯   년만 처음,World
차익 실현 움직임 속 뉴욕증시 혼조 다우        데일리국제금융시장 ,World
   후티 공습해 미사일   기 등 파괴 상당한 타격 ,World
지구 종말까지   초 전  핵 위협 기후 변화 등 위험요소 ,World
러  키이우 하르키우 집중 폭격  최소   명 사망 ,World
유엔사무총장   개국 해법 외에는 출구 없어   중동전 확대우려,World
트럼프 바이든  격차  더 벌어져 다자대결 시     차,World
뉴욕증시  실적장세 본격화 최고가 경신 부담에 혼조 마감,World
테슬라       루시드        전기차 니콜라 제외 일제  종합 ,World
북한 풍계리 핵실험장     년부터 건설  핵보유 야심 초기부터 선명,World
국제유가 소폭 하락 한파로 중단된  시설 재가동 리비아 생산 재개,World
미국 중국 증시 시총차   조 달러  경   사상 최대,World
뉴욕증시  기업 실적 주시하며 혼조 마감     또 최고치 종합 ,World
지구 종말까지 단    초   분쟁지역 핵확산 위협  기후변화 죽음 파괴 야기 ,World
지구종말시계  종말까지   초  핵 보유국 전쟁 개입 우려 커 ,World
 깜빡이 좀 켜고 들어와  택시 기사님이 화났다 중국나라 ,World
프라다 이어 구찌도 맨해튼 고가 빌딩 사들였다,World
엔비디아     상승에 필라델피아반도체지수       ,World
핵과학자들  지구 멸망까지 남은 시간   초  역대 최단 유지,World
 러 선박  척  북 나진항서 화물 싣고 회항 ,World
트럼프 대세론    헤일리 바람 뉴햄프셔주 결과 곧 공개,World
엔비디아 또 사상 최고  주가    달러 돌파 눈앞,World
 공화 경선 분수령 뉴햄프셔  트럼프 쐐기    헤일리 대반전 ,World
 르포 짬 내 온 직장인  자녀 손잡은 주부도 줄섰다 뉴햄프셔 경선 참여 열기,World
막 오른 뉴햄프셔 경선 한국 시간 오늘 낮 판가름,World
  공화당 뉴햄프셔 경선  분수령  금융시장 미칠 영향은 ,World
이스라엘군  칸 유니스 포위작전서 하루   명 전사  발표,World
지구 종말까지    초   기록 경신중인 온난화  핵위협 ,World
 실적장세  미증시 혼조        은  일연속 사상최고 상보 ,World
중국  대만 경제 무역 보복 돌입하나 징후 감지돼,World
러시아 대규모 공습에  우크라 최소   명 사망 ,World
  농촌 노인들  손주 세뱃돈 주다 거리 나앉을 판  정부까지 지도 나섰다,World
러  키이우 하르키우 대규모 공습  최소   명 사망  종합 보 ,World
러  우크라 키이우 등에 미사일   발  명 사망   명 부상,World
 뉴욕유가  리비아 생산 재개   한파 영향 속 하락,World
   러   미사일 우크라에 또 사용 북 러협력  김정은에 혜택  종합 ,World
바이든  진짜 패배하나  트럼프에    까지 뒤져 ,World
빈부격차 극심  탑  부자  자산     늘었다,World
 푸틴  대선 전엔 방북 계획 없다 ,World
 지구종말시계    초 남았다 ,World
트럼프 승리 쐐기냐  헤일리 반전이냐  민주는  낙태권  재점화,World
 트럼프  파죽지세  무섭다  년전 보다 더 저돌적이고 공격적 ,World
       달려와 영하   도 차박 트럼프 맹신한  성난 사람들     뉴햄프셔 프라이머리 가다 ,World
 여자라 할 수 없단 말 하지마라    세  일본판 송해  롱런 비결,World
러  키이우 등 대규모 공습   나토  우크라에 포탄 지원 계약,World
 지구종말시계  종말까지   초 작년과 같지만 안정 의미 아냐 ,World
   러   미사일 우크라에 또 사용 북 러협력 심화 우려 ,World
 여혐  콧방귀 끼던 헤일리  이제  여자가 승리     남녀 대결 띄웠다,World
막판 동분서주 헤일리  미래를 보자   트럼프는  대관식  준비 분주,World
그때는 맞고 지금은 틀리다  코로나 끝나자  팬데믹 협정  외면하는 선진국,World
큰 지진 났는데 원전 괜찮아  노토반도 시카 원전 재가동 논란,World
 바이든  다자대결서 트럼프에      뒤져 ,World
  대만 전문가     대만 침공보다 봉쇄 가능성 커 ,World
  년만에 처음 푸틴   월 대선 이후 방북할듯 재종합 ,World
 뉴햄프셔 경선  공화당 경선 중대 분수령에 투표소밖   여 까지 대기 행렬,World
 푸틴  대선 전엔 방북 계획 없어   월 이후 갈듯 종합 보 ,World
트럼프 독주체제    헤일리 이변 뉴햄프셔 경선 주목,World
 연방대법  멕시코 국경 철조망 제거   트럼프측  집권땐 재건 ,World
      민간 선박 공격  후티 추가 공습  후티  홍해 계속 막겠다 ,World
왕위와 멀어진   의 외동딸  첫 직장은 적십자,World
종교 갈등  선거 동력으로  모디  연임 노린  힌두교 정치 ,World
 르포 트럼프  내일 한명 사라질것  헤일리  경선은 마라톤 ,World
   위협  현실이 된  대선   바이든 딥페이크 음성  유포,World
빈부격차 극심한 멕시코서  탑  부자  자산  년간     늘어,World
호주 최대 건강보험사 해킹범은 러시아인     공동제재 종합 ,World
트럼트 독주냐  헤일리 반전이냐  공화당  차경선 뉴햄프셔 개시,World
러  키이우 등 대규모 공습  명 사망   명 부상,World
뉴욕증시  차익실현 압박에 혼조세로 출발,World
러시아 매체  삼성 러시아 공장  현지업체가 임대할 수도 ,World
 북한  김정은 지시로 통일 대헌장기념탑 철거    뉴스,World
수면 질 떨어뜨리는 이 음료  한 달에  번만 마셔도 영향 있다,World
하마스 유탄에 이스라엘 병사   명 몰사 개전 후 최대,World
맨홀 뚜껑까지  펑펑   춘제 앞둔   폭죽놀이 비상,World
      주 전  골드만삭스  연준   월에 금리 내린다 ,World
이스라엘  하마스에 휴전 제안 미국은  두 국가 해법  압박,World
 하마스  이스라엘의 두달 휴전안 거절 해외 탈출안도 거부 ,World
 투표 말라  바이든 목소리는 가짜 긴장 속 뉴햄프셔,World
 미스 일본 에 외국인    대회 취지 맞지 않아      인종은 상관없다 ,World
또다시 지진 중국 신장서 규모     강진에 사상자  명 발생,World
트럼프   반도체 사업 다 가져갔다    또 대만 방어에 부정적 답변,World
이스라엘 군인   명 하루동안 전사 지상전 최악의 날 종합 ,World
중국 키르기스스탄 국경서 규모   강진 중국서  명 사망 종합 ,World
인도 증시  홍콩 제치고 세계  위 시장 도약 시총  조    억 ,World
갤럭시      인도 판매 신기록 사전예약  일 만에   만대 돌파,World
푸틴  러 대선 이후 방북할 듯   년 만,World
 뉴햄프셔주 경선 투표 시작 트럼프 대세론    헤일리 반격,World
