titles,category
 이스라엘 선제공격은 평범한 대응 이었다는 하마스  필요했지만 실수 있어 ,World
 그야말로 불타고 있다    년 만에 연초부터  불장 ,World
 트럼프 대항마   공화 대선후보 디샌티스 중도 사퇴 트럼프 지지 선언,World
서방 제재 하나마나     러  사우디 제치고   최대 원유 공급국 등급,World
    눈 쌓이고  일주일새   명 죽었다 미국  북극 한파  비명,World
부러우면 지는건데  서  하얀 금  리튬    만  발견 여기는 중국 ,World
세계  위 리튬 보유국 됐다던 태국  이틀 만에 발표 철회,World
우크라 동부 러 점령지에 포격  최소   명 사망 ,World
트럼프 지지 선언한 디샌티스 후보직 전격 사퇴,World
러  사우디 제치고    최대 원유 공급국  등극 서방 제재 여파,World
 등 디샌티스 돌연 사퇴 미 공화당 경선  트럼프 대세 로 기우나,World
우크라이나  러시아 점령지 포격 최소   명 사망,World
 핵심광물   배제 비현실적  예외 적용해야  현대차 등  에 건의,World
 명 태운 전세기  아프간서 추락  명 생존,World
    미 공화 여론조사  트럼프     헤일리     ,World
현대차   정부에    광물 즉각 배제 비현실적 한시 허용 필요 ,World
 불구경  바이든   공화  트럼프 인지능력 논란  부채질,World
첫 경선  위 디샌티스 사퇴  트럼프 지지   공화당 경선  파전,World
 무료 배송 시대 막 내린다  특단의 대책에    발칵   정영효의 일본산업 분석 ,World
태국  리튬     만  찾아 세계  위 보유국 됐다더니 이틀 만에 철회,World
     가자 전쟁 종식 목표  합의안 협상 압박  이 팔 전쟁 ,World
의학  기술 그리고 암의 종말,World
     이상 도망가라  인니 므라피 화산 분출 잿빛 구름이 사방 뒤덮었다,World
 공화 대선후보 디샌티스 사퇴  트럼프가 바이든보다 우수 ,World
 월가    열풍      엔비디아 메타 모두 사상 최고치,World
가자지구 사망자  만    명 넘어   이스라엘 인질도  명 추가사망  이 팔전쟁 ,World
 월가    열풍           사상 최고치 경신,World
디샌티스 주지사도 결국  경선 하차  트럼프 지지 선언,World
    만 국민 허탈  리튬     만  찾았다  대박 외치더니 알고보니  만 ,World
 지구 온난화 당장 멈춰도     년까지 빙하  분의  사라진다 ,World
 다리  개  성기  개  기형 유기견 기적의 새삶 전세계가 도왔다,World
 이스라엘  하마스       만 제거   완전 소탕  의문 커져,World
 공화 대선후보 디샌티스 사퇴  트럼프 대세론  굳히나,World
      대선 공화당 대선후보 디샌티스 사퇴 트럼프 지지 선언,World
중동 확전 위기 고조 우크라 동부 포격  최소   명 사망 ,World
디샌티스  결국  공화 경선 레이스 하차 트럼프 지지 선언 종합 ,World
디샌티스 사퇴 공화 경선  트럼프 헤일리  양자 구도 재편,World
현대차   정부에    광물 즉각 배제 비현실적 한시 허용해야 ,World
 뉴햄프셔  대선 후보보다  부통령 후보 들이 더 많아 ,World
트럼프 아이오와 압승하자     년 더    로 달려간 바이든,World
한국은  만원 일본은     원   직장인 평균 점심값    배,World
이스라엘 하마스 협상하나     단계 전쟁 종식 목표,World
디샌티스  결국  공화 경선 레이스 하차 트럼프 지지 선언,World
 공화 디샌티스 후보 사퇴  트럼프 지지   대세론 굳히나,World
미  공화 대선후보 디샌티스 중도사퇴 트럼프    헤일리 양자대결로,World
트럼프   년 전 영광 재현  세몰이  헤일리   곳 폭풍 유세  강행군 ,World
서방세력    친이란 확전  이란  이라크 시리아  전방위 공격 ,World
미국  추위에 사망자 속출 호주는 폭염에 산불위험,World
 동맹국이라서      동맹국이라도  바이든 트럼프 가른 한마디  바이든 트럼프 뇌지도 ,World
여성    프레카리아트 더  성난 사람들 이  대선 승패 가른다  바이든 트럼프 뇌지도 ,World
이스라엘      이란의  저항의 축   잇단 충돌 더 불안해진 중동,World
독일 전역서 또 수십만명  극우 시위 인파 몰려 조기해산도,World
남부군 노예제 미화 동상 철거 제동  미국 인종주의 척결 흐름 역풍  워싱턴 아나토미 ,World
 중국이 대만 치면 한반도서 북한도   바이든 행정부 대북 낙관에 연일  경고음 ,World
   억류    웜비어 모친  헤일리 새 광고서 지지 발언 뉴햄프셔 겨냥,World
 르포  트럼프 대공세 맞서 헤일리 게릴라전,World
중동 곳곳서 무력충돌   확전 막을 시간 얼마 없다 ,World
   세계  번째로 달 착륙  태양전지 미작동에    점  자평,World
트럼프 대선 뒤집기 수사팀에  불륜  터졌다,World
전쟁    기후  세계 지도자들 화두는 한국과 달랐다,World
지진때 자판기 부수고 음료수 꺼내   서 불붙은  재난 윤리  논란,World
 하마스 땅굴에 치료제 없는 곰팡이가 인질 생명 위협  이 팔 전쟁 ,World
   연초부터      감원 칼바람      넘어 금융 유통 등 확산,World
  세 푸틴  올해도 영하 도 날씨에  얼음물 풍덩 ,World
 르포  대선 한복판에 떠오른  김정은 대북정책 이슈 ,World
   저출산 예산  유럽 절반 수준  육아지원 미래투자 더해야 ,World
네타냐후  하마스  인질석방 조건  항복 요구  전면 거부 ,World
 우크라 내 러시아 점령지 포격으로 최소   명 사망 ,World
아프간 북동부서 구급 전세기 추락  탑승  명 중  명 생존  종합 보 ,World
    열흘 폭격해도 끄떡없는 후티 상대로 장기 계획 수립 중 ,World
하마스  이스라엘 선제공격 변명  필요했지만 실수 있어 ,World
적설량      사망자   명 넘었다  북극으로 바뀐  ,World
우크라 동부 러 점령지 포격  최소   명 사망  종합 ,World
헤일리  중국은 팽창  북은 미사일 위협 한 미  더 힘 합쳐야 ,World
 이젠    가 벤치마크  올해   원유생산 또 새역사 쓴다,World
중국 철강업계  소화불량    떨어지는 철광석 가격  원자재 이슈탐구 ,World
 하마스 절멸 인질 구출 동시 달성 어렵다  이스라엘군서 회의론 이 팔 전쟁 ,World
 전선확대  중동 화약고   바이든 네타냐후 입장차 여전,World
 전역 덮친 북극한파  맹위  일주일새   명 목숨 앗아가,World
 뉴햄프셔경선       신경전  트럼프 헤일리  지지선언 발표하며 막판 세몰이,World
대만 청년들도  공무원 안해요  응시자   년 새 절반 뚝 ,World
 파벌 해체  결심한 기시다   존속 주장   인자 만나,World
 고작  만    태국      만  리튬 매장지 발견 주장 철회,World
헤일리    대 두 사내가 대통령 놓고 싸워  트럼프  난   세  정신은   년 전보다 온전 ,World
얼음물 입수에 푸틴 선거캠프 찾아간 여성들  가족 돌려달라  시위,World
존슨 전  총리  트럼프의 복귀  세계가 필요로 할 수도 ,World
  년 만에 최고치  반색한 일본 기대감 속 신중론 이유,World
기차역 지어주고 비번은 쉬쉬 아프리카    갑질에  에 밀착,World
이스라엘  의도적 전장 확대 미국 이란 대리전 불붙이나,World
아프간서 러시아 민간 항공기 추락해  명 사망,World
  관영매체       간섭 뿌리치고 반도체 수출 늘려야 ,World
 네타냐후  바이든도 무시   내각 분열 퇴진 압박에 더 극단적  마이 웨이 ,World
    군사력 저하  잘 버티는 후티,World
우크라군 평균 연령   세   신체적 감정적으로 완전히 지쳐 ,World
우크라 동부 러 점령지 포격  최소   명 사망 ,World
웜비어 모친 등장시킨 헤일리  김정은 친구 트럼프의 외교 믿을수 있나 ,World
황족 여성이 받는 훈장  첩이 받게 만든 친일파  김종성의  히  스토리  ,World
 남북의 사소한 충돌이 국지전으로 커질 수도   이영광의 거침없이 묻는 인터뷰 ,World
이스라엘  시리아 수도 공습 이란   명 사망,World
하마스측  개전후 사망자  만 천명 넘어   인질석방 실현에 의구심 ,World
 아프간 추락 항공기는 러시아 구급전세기로 판명    명 탑승 ,World
  개혁속도 확 끌어올릴 때    영원히 토론 만 하다 경제 망가져,World
 마크롱 프랑스 대통령 일냈다   유럽의 맹주  독일의 굴욕,World
태국  하얀 금맥  해프닝  이틀 만에  리튬     만톤 발견 무효 ,World
 르포 트럼프  부흥회 유세 로 세 과시 헤일리  게릴라 유세  표심 공략,World
트럼프  또 말실수 헤일리  너무 고령  인지 능력 의문 ,World
고율관세 수출통제     무력화 대통령 누가 되든   우선주의  충격파,World
이스라엘군 개전 후 하마스 전투원        사살  목표에 훨씬 미달 ,World
기시다 승부수에도 파벌해체  미완     자민당 균열 커지나  뉴스 투데이 ,World
     년  넘은 바이킹 검 발견됐다 글자 확인해 보니  깜짝 ,World
열흘째 때려도 안 꺾이는 후티     장기전 계획 수립 중 ,World
세계  번째로 달 착륙한   태양전지 고장에  반쪽 성공 ,World
      미국의 선택  웜비어  등장시킨 헤일리    김정은 두둔 한 트럼프 공격,World
중국 관영지    반도체    간섭 줄이고   수출 늘려야 ,World
요동치는 일본 정치   년 넘게 이어진  자민당 파벌  사라질까,World
국경도 바닷길도 막힌 중동 역내 무역 관광 위축에 경제 휘청,World
   골디락스 금리에    도 최고치  추가 상승 여력 ,World
일본 달 탐사선 착륙에도       점짜리 합격   운명 불투명   이유는 ,World
이번 주 세계 미리 보기 미 공화당 뉴햄프셔 경선  헤일리 이변  첫 질소가스 사형집행도 주목 월드콕  ,World
 리튬     만톤 찾았다  태국의 깜짝 발표 이틀 만에 결국,World
내가 펠로시  이름 헷갈린 트럼프에 헤일리  나이 들면 내리막길 당연 ,World
중국 경제     년   의 공포 이겨내려 안간힘,World
유세 중 시위에 트럼프  쫓아내라     헤일리  야유 말라 ,World
시리아 이라크 등 중동 곳곳 폭격음 역내 긴장 고조  중동 화약고  이스라엘 팔레스타인 분쟁 ,World
두 번째 경선  뉴햄프셔    트럼프  승기 굳히나 ,World
존슨 전 영국총리  트럼프 귀환  세계가 필요로 할 수도 있다 ,World
 오픈    샘 올트먼  오일머니 손잡고  엔비디아  독주 무너뜨리나,World
중앙일보 특파원 만난 헤일리      더 가까이 더 뭉쳐야  르포 ,World
대만 공무원 응시자    년 새 절반   대우 나은 민간부문으로 ,World
     만  리튬 있다던 태국  주장 철회  발견된 광물 자원 총량 ,World
 회삿일 힘들고  결혼 조건 높아지고  중국 결혼 기피 이유는,World
  이스라엘     이란  저항의 축  곳곳서 충돌 확전 위기 고조,World
 관영지      간섭 줄이고    반도체 수출 늘려야 ,World
 이주민 추방  극우 계획에     만명 시위  나치 정당 금지 ,World
우크라 전쟁 곧  년  평균연령   세,World
  경제 위기론 속 전문가들      년 성장률    근접할 것 ,World
이스라엘서 네타냐후 퇴진 시위 재부상 전시내각엔 균열음  중동 화약고  이스라엘 팔레스타인 분쟁 ,World
 희토류 헬륨   등 먼저 확보  달 탐사 경쟁 불붙었다,World
미국 본토      북극한파  영향 겨울폭풍  혹한에   명 사망,World
포드  전기차 감산  방침 현실화  곧  피바람  분다 ,World
이스라엘 시리아 공습에 이란 혁명수비대원  명 폭사 최종 목표는 미국 이란 대리전 ,World
이 정도면 나라 망신   리튬     만톤 발견  대박 났다더니 알고보니  만톤,World
이스라엘  이번엔 시리아 수도 건물 공습   이란 간부  명 사망,World
   년래 최약체 총통 라이칭더  중국에 기회와 도전 ,World
러시아에 뒷문 활짝 연 중국 작년 석유 최대수입국은 사우디 아닌 러시아,World
 김정은 말보다 과잉 대응이 더 위험    이코노미스트  한반도 전쟁 루머 너무 과장 ,World
 헤일리  좌파와 동맹      트럼프 정신 의문  불붙은 비방전,World
사상 최고치 찍은     향방은  불 마켓      슈가 러시 ,World
처칠이  차 세계대전때 쓴  틀니  경매 나온다 예상 낙찰가는,World
  자민당 파벌  개로 축소      위 파벌  존속 주장하며  반발 ,World
  평균 나이   살    대 넘은 부대도 우크라군 고령화에 골머리,World
 르포     뉴햄프셔 프라이머리   공화는 열기  경선지 변경  민주 냉랭,World
 대륙의 유튜브  비리비리  한달  억명 넘게 쓰는데 주가는  뚝 ,World
 아슬아슬한 합격  세계  번째 달착륙에도 웃지 않는  ,World
우크라이나의 신전략  방어가 최선의 공격 ,World
경매에 뜬     만원짜리  틀니  관심 폭발 누가 썼길래,World
푸틴이 과시한   억 전차  미국산 우크라 장갑차에  박살 ,World
 다리  개  성기  개  영국  에리얼   전세계 온정으로 새삶,World
 펠로시와 나를 여러 차례 혼동    헤일리  트럼프 인지능력 공격,World
태국   세계  대 리튬 보유국  주장 철회 발표 오류 인정,World
    부채 디플레 디리스킹 인구통계의      경제 재앙 직면 ,World
경매 나오는 처칠  전시 틀니  낙찰가     만원 예상,World
처칠  전시 틀니  경매 나온다 낙찰가  천   만원 예상,World
 다리  개  영국 유기견 전세계 성금 모여 새 삶 찾았다,World
우크라 병사 나이가 설마 이정도였어  평균연령   세에 연일 격전 치른다,World
미사일 주고받은 이란 파키스탄 불안한 봉합 최종 승자는 중국 ,World
대만 외교부장  앞으로   정보 조작 더 심해질 것 ,World
일본도 달 착륙 성공했다 미 러 중 인도 이어 세계  번째,World
올트먼의 신생   칩 기업 투자 논의에           소프트뱅크도 합류 ,World
중동 곳곳서 미사일 굉음  확전 막으려면 시간 얼마 없다  종합 ,World
 지방 소득격차 최대    배  위 상하이  내륙 간쑤성 최하위,World
  해군  후티반군 선박공습 요격 미사일 업그레이드,World
활활 타오르는 독일 반극우 시위 전국서   만명 거리로,World
뉴햄프셔 경선 앞두고 공방 가열   헤일리는 트럼프  고령  이슈화  트럼프는    정치인 동원 견제,World
 다리  개  영국 유기견  수술로 새삶 전세계서 모금 답지,World
 세계 최악 끔찍하다  자기 회사 욕한   택배사 챗봇,World
 바이든 경쟁자  필립스  바이든  자유세계 리더 하기에는 너무 늙어 ,World
 우리나라는 글렀어  탈출하는 러 부자들 푸켓 이민러시  만    명,World
 한국이면 민방위 끝났을 나이에  평균   세라는 우크라 군대,World
원서도 안냈는데  대학 합격하셨습니다  입학생 확 늘어난 이 나라,World
   동일본대지진에도 노토지진  피해 예상  재검토 안해   과소 추산,World
 중국  타이완 라이칭더   년만 최약체 총통 예상 희망과 기회 봐 ,World
존슨 전 영국 총리  트럼프 재선  세계에 큰 승리 될 수 있어 ,World
인니 장관        조 천억원 투자해   만대 제조공장 건설 ,World
이란 핵보유 임박했다 이 남자의 절규  지금 세계는 외교  외교  외교가 필요하다 ,World
폴란드 강 바닥서 발견된     년 넘은 바이킹 검,World
일본 자민당 파벌 잇단 해산에도    위 파벌은 존속 결정,World
풀코스 내내  줄담배  피우는 마라토너의 놀라운 기록,World
 벤츠 사랑  김정은  억    만원 새 마이바흐 포착  어떻게 샀나,World
워싱턴 정가 고령 이슈 재부각 트럼프  헤일리 펠로시 혼동,World
이스라엘 미국  중동 곳곳서 친이란  저항의 축 과 충돌,World
사이판 브라질 인도양  한날 몰아친 규모  대 강진,World
    대만 라이칭더   년만 최약체 총통 예상 희망과 기회 봐 ,World
존슨 전 영국총리  트럼프의 백악관 복귀  세계에 필요할 수도 ,World
 친이란  이라크 무장세력  미군기지 공습 미군 다수 부상,World
북 김정은의 노골적 핵위협 미  심각하게 받아들여야 ,World
 올드맨의 귀환  마이너스 금리 종결 앞두고   베테랑 증권맨 쟁탈전 원호연의     ,World
 월급만   억  월가  연봉킹 은 누구   세모금 ,World
시리아 이라크 등 중동 곳곳 이스라엘     저항의 축  공방 확전 우려 고조,World
푸틴 극찬한    억 전차   미국산 장갑차에 산산조각  영상 ,World
 오픈   올트먼    반도체 개발 위해     와 손잡나,World
예멘 후티 반군 공습 실패하고도 태연한 바이든 행정부,World
창살 안에서 시작된 새로운 문화,World
중국 경제 불확실성 국제 사회의 냉정한 전망  와이즈픽 ,World
 인질 데려오고 네타냐후 물러나라  이스라엘서 대규모 시위,World
   년 만의 경사  이라크 국민들 환호 충격에 빠진  ,World
트럼프 맨체스터 유세에 사우스캐롤라이나 주지사 등 불러 헤일리 견제,World
 인질 데려오고  네타냐후 물러나라  이스라엘인들 대거 거리로,World
  년 일하면 집이 한 채  잘나가던 직업  지금은  절레절레   정영효의 일본산업 분석 ,World
대만인들의 선거 관심은 친중 반중 아닌  민생 이었다,World
     년  넘은 바이킹 검  폴란드 강 바닥 진흙서 발견,World
 뉴스  전쟁사 노스트라다무스의 새해  전쟁 예언  주목하는 세계,World
톨게이트서 후진 고속도로 역주행 검거된 베트남 남성이 한 말,World
애 낳으면 노후가 흔들       보고서 속  국민연금 보면     보기 ,World
 특파원 시선  새해 벽두 뉴욕에서 들었던  폭발음 ,World
 노젓기 운동    년 경력   세 아일랜드 선수  신체 나이는   대,World
텐트 치고 오픈런  웃돈   배 미국 휩쓴  스탠리   친환경 맞아 ,World
지난해 사우디 제치고 중국 최대 석유 수출국으로 떠오른  이 나라 ,World
국가가 부부 잠자리까지 간섭  애 낳아라  계속 문자 보낸다고   한중일 톺아보기 ,World
달걀값     급등한 러시아 전쟁자금 국민불만 인플레  삼중고  직면,World
민진당 승리 대만 총통 선거 트럼프 재선에 유리 ,World
 해외 국민도 한 표를    상하이  총선 선거인 등록 열기,World
이라크 알아사드  공군기지 공격받아 바그다드 부근 무인기도 추락,World
 시장 시의원에 교육위원까지    미국 정계 한인들의 약진,World
  정치인 연령 논란 재점화 트럼프  헤일리 펠로시 혼동,World
 한인 청년들 꼭 투표를    캐나다  총선 선거인 등록 한창,World
러시아  작년 중국의 최대 석유 수출국 부상 중동 산유국 사우디도 제쳐,World
청년실업률     줄여 발표    통계 마사지  사이즈가 달랐다,World
클린스만호  딱 최소한의 자존심만 세웠다     강 상대는 일본  사우디 ,World
러  영국 바렌츠해 어업에 제동  피시앤드칩스 위협 ,World
바이든은  두 국가 해법    네타냐후는     ,World
하마스와 전쟁 이스라엘  사상 첫 여군 최전선 투입 왜 ,World
  탐사선 세계  번째로 달 착륙 성공   태양광 패널엔  문제 ,World
이란  첫 위성 발사 성공       궤도 안착 ,World
 아  이럴 줄 몰랐다  유명 언론사도 감원 칼바람 무슨 일이 ,World
유동성 위기   부동산 개발업체 완다  대형 쇼핑몰   개 매각,World
바이든은  두 국가 해법    네타냐후는     ,World
미  북 수중 핵 시험  진위 떠나 문제 전쟁 위협 심각하게 봐야 ,World
이스라엘  최전선에 여군 첫 투입 가자전쟁에   성차별도 깨져,World
이란  위성  소라야  발사 성공      궤도 안착 ,World
경쟁자 헤일리에 인종차별적 공격 이어가는 트럼프,World
  파시스트  재림 우려 커지는 이탈리아  육군 전범 달력까지 이러다가 ,World
전쟁 기후위기에 위험지역 된 해협 운하   물류 경색  비상  세계는 지금 ,World
 파시즘 부활  우려 커지는 이탈리아 육군  전범  달력 발행,World
일본  세계  번째 달 착륙 성공했지만  점수는   점 ,World
 한국인  일본서    조 원 썼다  작년 일본 여행    만 명 육박,World
 불났어요  이번엔 비행 중  엔진 화재  보잉 왜 이러나,World
일본  달 탐사선 착륙 성공 세계  번째,World
 얼굴 달라지면 귀국 못한다     한국  성형 관광  경고,World
 만    원에 드론 격추       거리 동전 맞히는    용의 불꽃  정체,World
 뉴스추적   일 완구회사까지  달 탐사에 참여 전 세계 우주경쟁 가속화,World
트럼프  헤일리 부통령후보 지명 없다  헤일리도  부통령 안해 ,World
이스라엘  건국 후 처음으로 최전선에 여군 투입 전쟁에  군 성차별 도 깨져,World
아마존  일본에   조원 투자     보급으로 데이터량 급증 ,World
   달착륙 성공 판단에도  겨우   점  왜 ,World
이스라엘  시리아 공습으로  명 사망 친이란 세력 사용하던 건물 타깃 상보 ,World
가자지구부터 파키스탄까지 이란  중동분쟁  단골된 이유는,World
이스라엘군  시리아 수도 공습  이란혁명수비대원  명 등 사망 ,World
 나 건강해  건재 과시     세  푸틴  영하 날씨에도 얼음물  풍덩 ,World
엔진에  불  붙고 도로에  비상착륙  미 잇단 비행 사고,World
  세 푸틴  올해도 얼음물 입수  크렘린궁 발표  건강과시 ,World
  도  최전선 에서 싸운다 이스라엘  군 성차별   가자전쟁에 깨져,World
 포착  가자지구 공동묘지 파헤친 이스라엘군 위성에  딱 ,World
 바이든  년  살림살이 나아지셨나  트럼프가 자신만만한 까닭  박민기의 월드버스 ,World
이스라엘  가자 최전선에 여군 첫 투입,World
 지구촌톡톡  지난해 일본 찾은 한국인    만명 방문객 중  위  ,World
이스라엘  가자전쟁 최전선에 여군 첫 투입,World
 지구촌톡톡  브루나이 왕자의 초호화 결혼식 하객들도 세계 정상급  ,World
 최전선에 여자가 나타났다  이스라엘  전쟁에 여군 투입 이러다가 ,World
네타냐후  두국가 해법  기조 바뀌나 바이든  불가능하지 않다  이 팔 전쟁 ,World
내각 분열 거센 시위 다중압박 처한  마이웨이  네타냐후 정부,World
마크롱  러시아 승리 안보종말  무기증산 혁신 주문,World
이  하마스 최전선에 여군 건국이래 첫 투입 군 성차별 깨졌다,World
이스라엘  외교해법 없으면 헤즈볼라와도 전쟁 ,World
바이든 네타냐후  가자해법  인식차 전쟁 확산할라,World
 개  개 축소  일 자민당 파벌  해체 기로 관건은  인자 선택,World
 자막뉴스  끝이 보이지 않는 컨테이너 행렬    중국  일대일로  근황,World
 개  개 축소   자민당 파벌  해체 기로 관건은  인자 선택,World
 총리가 선수단에게 포상금 지시  이라크 전역    년만에   꺾고 난리났다,World
달 착륙  턱걸이  성공한     겨우   점 합격  침통,World
   키우는 메타 수조원 들여 엔비디아 칩 확보,World
  배터리 기업들  세계 최대 리튬 보유국 칠레 진출 타진,World
 우크라에 포탄    만발을   또 총대 멘 에스토니아 총리,World
  달 탐사선  착륙했지만    점짜리 성공  촬영 목표치 못 채울 듯,World
푸틴이 자랑했던   억짜리 전차 미국산 장갑차에 완전히  박살 ,World
한 달만에 통화한 바이든 네타냐후   입장차 뚜렷,World
바이든 네타냐후 한 달만의 통화에도  두 국가 해법  이견만 부각,World
 한국 닮은 꼴  대만  홍콩이 되길 거부하다,World
뉴햄프셔 경선 코앞  트럼프 지지한 흑인 중진 한방 먹은 헤일리,World
 왕이  홍해 긴장 고조 말고 예멘 주권 존중하라  비판 이 팔 전쟁 ,World
 겨우 합격인   점  굳은 표정 달 착륙 성공에도   분위기  침통 ,World
  배터리 기업들 칠레 공장 욕심낸다는데,World
   세계  번째 달 착륙 성공 동력 잃어  절반의 성공 ,World
한 달 만의 통화인데 바이든 네타냐후  불협화음 만 부각,World
중동 확전 우려 키웠던 이란 파키스탄  사흘 만 극적 화해,World
헤일리  트럼프의 부통령 싫다   인자 안 할 것 ,World
공습 주고받던 이란 파키스탄  사흘 만에  화해 ,World
미사일 쏘다  형제여  이란 파키스탄 화해,World
한 달만의 통화인데 바이든 네타냐후  불협화음 만 부각,World
    대만 라이칭더  절반의 승리 에 희망 기회 엿보고 있어 ,World
공습 주고받던 이란 파키스탄  사흘 만에  형제의 나라  화해,World
  기업들  칠레 리튬공장 설립 검토  양극재  수출 노려 ,World
미군  노후 핵미사일 교체 비용 껑충  중 러 견제 차원 ,World
 이스라엘 하마스  둘 다 가자지구 통제력 상실 ,World
