titles,category
  년 연속 적자  롯데케미칼  증권가 목표가 하향에도   대 강세,Economics
   억원대 전세사기범에 구형보다  년 긴   년형 선고,Economics
세계 스마트폰  위 시장서 갤     난리  역대 최대 사전예약 성공,Economics
 아이 울음 어디가고  곡 소리만 늘어  매달  만 명 줄더니   만 명 사라져   저출생에 결혼까지  뚝   이러다간,Economics
쎌바이오텍  올해 대장암 치료제 임상 상     승인 목표 ,Economics
 소액생계비 받으러 갔다가 취업까지  금융 고용 복합지원 나선다,Economics
청년희망적금 만기 도약계좌 갈아타기 내일부터  신청 ,Economics
셀트리온  우시    와     신약 개발 맞손   개 품목      ,Economics
 줄파산  악몽이 또 하도급 업체  돈 못 받았다  태영건설  후폭풍 ,Economics
검찰   흉기로 아내 살해   대 징역   년 너무 가볍다  항소,Economics
