titles,category
 블핑 리사와 열애설  루이비통  넷째       이사회 입성한다,World
크렘린궁 대변인  푸틴   월 대선 뒤 방북할 듯  종합 ,World
뉴햄프셔  이번엔  오작동 풍향계  오명 벗나,World
 헌법재판소  극우 조국당  민주주의 파괴 목표 국가자금 지원 안 돼  판결,World
인공지능 열풍에       유럽 내 시가총액  위로 도약,World
넬슨 만델라 유품 무더기 경매  발칵 ,World
일주일 넘게 미국 얼린 북극 한파 이번엔 홍수 위험,World
트럼프  내일이면 남은 한 명 사라질 것  헤일리에 사퇴 압박,World
 러 선박  척  북 나진항서 화물 싣고 회항 ,World
   열풍에       유럽 내 시가총액  위로,World
튀르키예 의회   오늘 중으로  스웨덴의 나토가입 비준예상,World
     주가  유럽 내 시가총액  위  인공지능 열풍 ,World
 트럼프 헤일리 맞대결  뉴햄프셔 투표 시작 공화당 경선 분수령,World
중국 윈난성 산사태 사망자   명으로 아직   명 행방불명,World
독일 극우정당 재정지원 끊어    도 헌재 가나,World
머스크   에  유대주의 가장 적어 ,World
토요타 회장  전기차 점유율     못 넘을 것 ,World
 이스라엘  인질석방 두달 휴전 제안 하마스 수뇌부 가자 탈출도 제의 ,World
니켈값  년 새  반토막   위 생산국 울상,World
 월드 이슈  달탐사 경쟁 치열 일본은  절반의 성공 ,World
중국 신장 규모     강진  인접국도 진동 윈난 산사태 구조 난항,World
유세장 앞자리 독점  사생팬   트럼프는 미국의 영웅  아이언맨 ,World
 투표 말라  바이든 목소리는 가짜 긴장 속 뉴햄프셔,World
애플     헤드셋  비전 프로  판매 호조에 시총  위 복귀,World
중국 윈난성 산사태  사망자   명으로 신장엔 규모     강진,World
    억 들여 복원한 힌두사원 알고보니 본인 출정식 무대  셀프준비 ,World
만델라 유품 무더기로 경매에 정부 반대  유족은 내홍,World
만델라 유품 무더기로 경매에 정부 반대  유족은 내홍,World
일본 고속철도 신칸센  정전사고로 대규모 운행 중단,World
    년생    아이코 공주가 택한  첫 직장 ,World
  마이너스 금리 유지하지만  물가 임금 선순환 진전  해제 한발 가까이,World
  매체  이스라엘  인질 석방  개월 교전 중단 제안 ,World
 여권 안 챙겼는데  겨울 폭풍에   국내선  다른 나라 착륙,World
미스 저팬 맞아  우크라이나 출신 귀화 여성이   미인대회  위,World
 미스 일본 에 우크라이나 출신   일본인 맞나   논란,World
이스라엘군 지상전 최악의 날 하루 새   명 사망 종합 ,World
디샌티스 후보 사퇴에  지지율 상승한 트럼프 독주 태세,World
중국 신장 규모     강진  인접국도 진동 윈난 산사태 구조 난항,World
물밑서 출구 전략 찾는 이스라엘    개월 휴전 인질 전원 석방  제안,World
 트럼프 재선시    반도체 위기    최악의 상황 진단  지금이뉴스 ,World
이스라엘   휴전위해 하마스 고위지도자 가자 떠나라  제안 이 팔 전쟁 ,World
나토     조원 규모 포탄 공동구매 계약 체결 우크라 지원,World
하마스 공격에 이스라엘 병사   명 사망 개전후 최대,World
     국가 해법  촉구에 이스라엘 엉뚱 제안  가자 앞바다 인공섬   중동 화약고  이스라엘 팔레스타인 분쟁 ,World
유럽 겨울 폭풍에 비행기 잇따라 회항 미국  북극한파 가고 홍수 비상,World
승계 못하는   아이코 공주  취업한다 첫 직장은 어디 ,World
하마스 공격으로 이스라엘군   명 몰사 개전 후 최대,World
 북극한파에 맥 못추네  전기차 수요 둔화에 니켈 가격도 급락,World
미 영  친이란 후티 홍해공격 기반에 다시 대대적 공습 종합 보 ,World
전기차 수요 둔화에 니켈 가격도 급락 인니 광산업체  울상 ,World
하마스    에 와르르 이스라엘 군인   명 전사  개전 후 최대,World
하마스 공격에 이스라엘 병사   명 몰사 개전후 최대 종합 ,World
  뉴햄프셔 공화당 경선    지지자들  어차피 대세는 트럼프 ,World
정부 지출 삭감  서방에 원조 요청  에콰도르   갱단과의 전쟁  장기전 채비,World
닛케이  경기 정책  훈풍    년만에  버블  넘어서는  ,World
 경제합시다  트럼프가  뜨면  기준금리가  떤다 ,World
  다우지수      최고치 경신 나스닥도  초읽기 ,World
 의 전쟁  게임 체인저     가 포기한  꿈의 포탄  개발  지금이뉴스 ,World
막오른 뉴햄프셔경선 트럼프  헤일리  내일 사라져  헤일리  트럼프  겁먹어 ,World
 연준  물가보다 침체 대응에 기울었다 현시점 침체 확률     ,World
 브렉시트  영국처럼 독일도  덱시트     극우정당의  베팅  먹힐까 ,World
     개발 포기한 레일건 제작 성공  실전능력은 미지수,World
 투표마라  트럼프 돕는 일  바이든이 건 전화  알고 보니      녹취록 ,World
하마스 공격에 이스라엘 병사   명 몰살 이  아군 폭발물 터져 ,World
 연임 노리는 모디 인도총리   힌두교 성지서 황제같은 출정식,World
    금리 동결했지만   월 인상론  힘받는다,World
곤두박질 친  증시 금융위기 때보다 실탄  배 더 투입,World
전문가들  중국  대만 침공보다 봉쇄 가능성 커 ,World
미    등 국제사회는  종전  압박 이스라엘은   개월 휴전  제안,World
왕위 멀어진 일왕 외동딸 아이코 공주  첫 직장은 어디 ,World
  단종   년만  플로피디스크  퇴출  비용 시간 절감 ,World
 중국 경제 둔화에  억명 중산층 붕괴 위기 ,World
 투표하지 말라  바이든 목소리로 걸려온 전화  알고보니     ,World
 뉴스   트럼프  대선 후보 굳힐 듯   헤일리  최후의 추격전,World
미스 일본 우승자는 우크라 출신 귀화 여성  인종의 벽 넘었다 ,World
  비트코인 현물     해킹은 심 스와핑 공격 때문 ,World
 미인대회 우승한 우크라 출신 귀화인  다양성 인정 원해 ,World
 러시아 대비  독일  병력  만명 증강하기로 외인 입대 허용 거론,World
 위 굳히기          맥라렌 스타일 고급 전기차 출시,World
우크라     발 쏠 때 러시아는  만발   북한산 무기  위협 증폭,World
 자막뉴스  초강대국  지옥의 미사일 폭풍   대규모 무기마저 비웃는 후티 반군,World
 뉴스속 용어 가격 인하가  캐즘         극복 촉매제 될까 ,World
 월클뉴스  미국 증시는 이미  어대트   날개 단  트럼프 테마주 ,World
 같은 정당 맞나  골 깊어지는 트럼프 헤일리 지지자들 뉴햄프셔의 선택은,World
   위협 현실화된  대선  바이든 딥페이크 음성  유포,World
 영상  미 영 연합  후티 반군 기지 공습 미사일 무기고 등  곳 타격,World
중국 신장자치구서 규모     강진   구호 인력     명 급파,World
 투표하지 말라 는 가짜 바이든    선거개입  현실이 됐다,World
    대만 침략보다 봉쇄 나설 듯  지원 없으면  개월 저항 ,World
트럼프  친바이든  헤일리  혼란의 인물  뉴햄프셔 최종 유세 격돌,World
 올해 대만해협 위기 가능성 중국  상륙보다 격리 봉쇄 전망 ,World
   북극 한파  물러가자 폭우 덮쳤다     만명 홍수 위험,World
이란  엄청난 파괴력 있는 미사일 공격   경악한 이스라엘   녹취록 ,World
일본은행  통화정책 동결 금리인상 시점  결정 안 됐다 지만 ,World
이상기후에 널뛰는   날씨 혹한 직후 최대     기온 급상승,World
 영상  미 영 후티 총공습     저항의 축  지원하는 이란 확전  레드라인  경고,World
중국군 과학자  미국이 포기한  레일건  마하 로 개발  주장,World
블룸버그  미 중 반도체 전쟁에 어려움 처한 한국   편에 서야 ,World
헬기 타고 콜드플레이 보러 간 필리핀 대통령     기후 악당  비판 쏟아진 이유는 ,World
   일자리 침공이 예상보다 더딘 이유는  슬프게도  가성비 ,World
트럼프  내일 한명 사퇴할 것     헤일리  대선은 마라톤 ,World
북한이 전쟁 불사한다고       전문가 대다수 동의 안해 ,World
  증시   년  최저치 추락에 시장안정기금    조원 투입,World
 뉴스속 용어 지갑닫는   중산층 재테크 트렌드  특공대식 예금 ,World
가자전쟁  정책에 뿔난 반전단체  투표용지에  휴전  적어라 ,World
 대법  멕시코 국경 철조망 제거 허용  바이든 행정부 손 들어줘,World
중국  증시 급락에    조원 투입 검토 항셍      ,World
      조원 규모 부양책 검토 홍콩 항셍지수 상승,World
트럼프 조기확정이냐  헤일리 기사회생이냐 막 오른 뉴햄프셔 결투,World
도요타 주가  연초대비     상승   기업 시총 역대  위 ,World
끈끈한 동료애 보여준 네이비실 미 해군  순직자  명 신원 공개,World
 우크라 침공은 치명적 실수  푸틴에 도전장 낸 간 큰 대선후보 피플  포커스 ,World
중국  대만 침공 역량은 아직     봉쇄하면 대만    개월 버틸 듯 ,World
 어차피 트럼프    세계는 벌써  트럼프  기  준비중 디브리핑 ,World
기세 오른 트럼프  사법 리스크에도 굳건   신속 재판 가능성 ,World
  신장자치구서     규모 강진 여진   차례 발생,World
    강세흐름 놓칠라  다우 사상 최고치 경신,World
 헤일리  내일 사라져   트럼프  겁먹어  막판 유세서 날선 공방전  뉴햄프셔경선     ,World
하마스 공격에 이스라엘 병사   명 전사 개전후 최대,World
중국  조위안 긴급 투입에도  항셍지수 바닥 점치는 사람 없다 ,World
북한제 최신 미사일 나타났다   우크라 방공망  위태위태 ,World
이스라엘  휴전 협상 와중 가자 남부 맹폭    안전지대 마저 공격,World
 미스 일본  우승한 우크라 출신 귀화인 반응 갈려 영상 ,World
  대만 경제 보복 돌입 기류 감지   대만 침공보단 해협봉쇄 가능성 높아 ,World
 러시아 많은 화약고 만들 것     북 러 밀착 예의주시,World
 우크라전  러 스파이 모을 절호의 기회         포섭 박차,World
    대만 침공 아닌 봉쇄 택할 것   개입 없으면  개월 버틴다 ,World
  보란 듯  공군 정찰기 대만 공역 비행  민항기에 포착,World
   인도양 몰디브에 위장 첩보함 파견 인도군  촉각 ,World
 신장   년 만의 강진  부상자  명  인구밀도 낮은 지역,World
길거리 연주하던 영국 유튜버 중국인들의 이 말 듣고 싸운 이유,World
 애국주의 열풍에    샤오미  애플 제치고 중국 스마트폰 판매  위,World
 뉴햄프셔경선      헤일리  김정은에 웜비어 면죄부  트럼프  내가 데려와  종합 ,World
경기 정책  두날개     증시 역사점 고점,World
  공군 전락폭격기        자위대와 동해서 합동훈련 진행,World
     불기둥 곧 열린다  전망 바이오 개미들  두근두근 ,World
    예멘 후티에  포세이돈 궁수 작전  토마호크      출격 종합 보 ,World
 뉴햄프셔경선      트럼프  헤일리  내일 사라져  헤일리  트럼프  겁먹어  종합 ,World
 미중 반도체 전쟁에 끼인 한국  트럼프 당선되면  다시 위기,World
  금융완화 유지  월 마이너스금리 해제 기대 ,World
 러시아의 공격 가능성   독일군  초유의 결정  디지털리포트 ,World
 이민자 나라  캐나다   주택난 으로 외국인 유학생 수 제한,World
북한 신형 미사일 시험장 된 우크라  새로운 골칫거리 ,World
 이스라엘  인질 전원석방 협상안 제안  논의 물꼬 트일까,World
    대만 침공 아니라 봉쇄 미군 안 오면 최대  개월 버텨 ,World
화성 상공 가로지르는  비행기   물과 생명체 흔적 찾는다 ,World
     국제금값     오를 것 ,World
북극 한파 일본도 강타 북부 동해안 지역 최대      적설 예고,World
미일 증시 뛰는데 홀로 추락하는 중국   외국인  셀 차이나 로     년 이후 최악의 출발,World
 이스라엘  휴전 협상에 하마스 지도자 가자지구 떠나도록 제안     ,World
중국군 과학자    포기한 마하  속도 레일건 포탄 개발했다 ,World
마이너스 금리 고수한 일본   임금 물가 동향 지켜봐야 ,World
 인도   년 뒤 세계  위 경제 대국 된다 ,World
북한이 우크라 전쟁에 개입한 진짜 이유    덕분에 러시아 승리할 수도  송현서의 디테일 ,World
중동  개국  가자지구  평화중재안  마련    두 국가 해법  압박하는 국제사회,World
 뉴햄프셔 경선      바이든 경쟁자는  휴전   각종 캠페인 눈길,World
인도에  년 넘게 공 들이더니   소니  합병 철회한 이유,World
러   서 무기 얻어가나    북한 나진항서 러시아 선박 포착 ,World
  경선서     가짜 목소리  첫 등장  슈퍼 선거의 해  전세계 주의보,World
미국도 포기했는데    꿈의 포탄  개발 성공 ,World
일주일 만에  조원 썰물      효과 끝  비트코인   만달러 깨졌다,World
신장 아커쑤     규모 강진     이상 여진만   차례 이어져,World
트럼프 굳히기냐  헤일리 반전이냐    미 공화 경선  분수령 ,World
  신장 강타 규모     강진으로 건물 붕괴 부상자 속출 여진   차례,World
     조 증안기금 투입에 항셍     장기 효과는 글쎄 종합  ,World
  진출  은행  올해 최대 리스크는 부동산  우량기업 선별해 대출 ,World
유럽 겨울 폭풍에 비행기 잇따라 회항 미국  북극한파 가고 홍수 비상,World
러 점령지 포격에 사상자 속출 유엔서 또 날선 공방,World
중국 윈난성 산사태   명 사망   여 명 매몰 신장에는 강진,World
우리 곁에 있는 세계 최대 시장을 포기할 수 있는가 ,World
  요구에도 이스라엘이 완강히 거부  두 국가 해법 이란 딥포커스 ,World
첫 예비선거     트럼프 굳히기  바이든은 ,World
중국군 과학자    포기한 마하  속도 레일건 포탄 개발  주장,World
 자막뉴스  박살 난 러시아 유류 창고    게임 체인저 된 우크라 공격 목표,World
얼어붙은 지구촌  북극 데이터마저  꽁꽁  기후 예측 더 어려워졌다,World
     조 홍콩증시 투입 소식에 항셍지수    이상 급등 종합 ,World
 윤석열 자체가 싫다 던 북한이  년만에 내놓은  진심   소셜 코리아 ,World
  진출   은행   경제 최대 리스크는 부동산 위험 확산 ,World
 노토강진으로 쓰레기만   만      발생    년치 규모 ,World
 발사 넘어 운송    우주 기업   운송 우주선  개발 몰두,World
 미중 반도체 전쟁에 끼인   트럼프 재선시 불확실성 증폭 ,World
이례적인 일 벌어진 러시아   푸틴에 도전장 낸  반전 인물   지금이뉴스 ,World
독일 반극우시위를 보며 우리의 현재를 생각하다,World
  증시 역대급 호황  외국인 투자 덕분  서 자금유입도 영향 ,World
트럼프  무역전쟁 예고   집권 땐 모든 수입품에 관세     이상 부과  또 공언,World
홍콩증시  중국본토보다 더  암울   인도에 세계 시총  위도 뺏겼다,World
대만 선거 열흘 만에 침묵 깬  관영지  통일 대세 대항하면 산산조각 ,World
 통화정책  경제 기대에 닛케이도 신기록,World
경기낙관 힘입어  증시 사상최고치 경신,World
   경제 보복 시작   대만산 농수산물   종 무관세 중단할 듯 ,World
 디샌티스 사퇴 후   만 달러 모금   막판 총력  나선 헤일리,World
비트코인  현물     승인 후 하락세   왜 ,World
        미스 일본  우승한 우크라 출신 귀화인 일본인들 반응은 ,World
 대세  트럼프  사법리스크 넘을까  대선 전 유죄판결 가능성 ,World
명품 팔아서 부동산 산다 구찌 모기업      조  맨허튼 건물 매입,World
 트럼프 승리 에 베팅하는  증시  테마주 하루     폭등,World
  최고미녀 뽑는 대회서  우크라인  출신  등    어리둥절 ,World
북한 미사일 추가 지원 때 우크라 대공방어 무너질 우려,World
샤오미  애플 제치고 작년   월 중국 스마트폰 판매  위 올라,World
농민 분노 파고드는 독일 프랑스 극우 정당        농업 파괴  막겠다 ,World
 중국의 대만 전략은 침공보다 봉쇄    지원 없으면  개월 버텨 ,World
삼성전자  갤럭시     탑재    모델    개  년 전 대비   배 ,World
가자 전쟁 이후  레바논 남부서 이스라엘 공격으로    명 이상 숨져,World
   신형 미사일  우크라 전장 새로운 골칫거리로 ,World
연초  천장  뚫은 미일 증시 바닥 향하는 중국과 대비,World
독일  러시아 견제  군인  만명 모집  외국인 입대도 고려 ,World
 미스 일본  대상에 우크라 출신 귀화인  다양성 존중 사회 만들고 싶어 ,World
정부가 교통위반딱지 위조했다고  재정난에  꼼수  덜미잡힌  ,World
미  이스라엘에   청소년 피살 조사하라  인질가족 의회 난입,World
  증시 강세에 시총   조엔 종목 한달새  개 ,World
인도네시아서 화산  곳 연이어 폭발  주민 수천 명 대피,World
중국서 북러 밀착 경고 목소리  러시아 움직임 주시해야 ,World
트럼프    헤일리  뉴햄프셔 맞대결     현지 분위기는,World
푸틴에 대선 도전장 낸   세 러시아  반전 정치인 ,World
 트럼프 테마주  하루에     폭등 디샌티스 하차로  날개 ,World
미 영 연합군  후티 반군 시설 또 때렸다  군사력     파괴 ,World
  가 일자리 뺏는다        인간이 더 효율 ,World
 안전하게 돈 번다  환호 투자금 몰려드는  이 상품 ,World
 영상  우크라 드론         날아 러시아 때렸다   탄도미사일급 사정거리,World
  무력 위협 의식  대만          전차 도입 상반기로 서둘러,World
 우크라 전장의 새로운 골칫거리  북한 신형 미사일 ,World
폭풍  이샤 로 유럽 항공편 우회 잇따라   아일랜드서 항공 대란,World
  무슬림 보란듯 종교 분쟁지에 사원  힌두 민족주의  모디 총선 승부수,World
 서 북러 밀착 경고 목소리  러시아 움직임 주시해야 ,World
미 대선 후보 경선 주별  당별 천차만별       대선 ,World
국내선 항공기가 왜 옆나라에     시속      겨울폭풍에 아수라장 된 영국,World
 미 전략폭격기      대  지난주 동해서 일본 자위대와 연합훈련 ,World
바이든 없는 민주당 뉴햄프셔 경선 지지자들  이름 쓰기  운동,World
 싱크탱크     대만 침공보다 봉쇄 가능성      대만 왕따  외교 가속화,World
비트코인     승인 후 하락세 지속  만 달러선도 무너져 종합 ,World
비트코인    이상 급락   만    달러도 붕괴 위험,World
  떠나는 투자자들  서 돈번다,World
골드만삭스  연준 올해  회 금리 인하    인플레  전망,World
 서 무기 얻어가는 듯한 러시아 선박  영국 위성에 딱 걸렸다  포착 ,World
 노토강진 쓰레기  만  발생에  골머리   일부 도시선   년치 ,World
북극한파 지나니 이번엔 물난리       만명 위험,World
  닛케이   거품 붕괴  후   년 만 최고  증시 통화정책 유지 기대,World
미  북극 한파  물러가자 폭우 진눈깨비 일부 홍수주의보 발령,World
   전략폭격기      대  지난주 동해서   자위대와 연합훈련 ,World
 대세 트럼프에 눈도장 찍자  부통령 후보들 너도나도  지지 유세 ,World
 해산  발표해놓고 다시 파벌 존속시키려는  자민당  갈팡질팡 ,World
골드만  미 연준 올해  회 금리 인하      인플레 전망,World
  경제 활공할 것  경기 낙관론에 다우     사상 최고,World
 미스일본 에 우크라 귀화 여성   네티즌  상관없다      대표성 떨어져 ,World
    예멘 후티 반군 겨냥 두 번째 공습  반드시 응징 ,World
    대만 침공보다는 봉쇄        설문 결과 의미는,World
 일본 강진은 인과응보 라던 중국  신장자치구서 규모   지진,World
인도 우즈벡까지 진동 퍼졌다  중국 신장자치구서 규모     지진,World
러 점령지 포격에 사상자 속출 유엔서 또 날선 공방,World
   라멘가게  역대 최대 규모 줄도산  고물가 인건비 못 견뎌 ,World
유럽 겨울 폭풍에 비행기 잇따라 회항 미국  북극한파 가고 홍수 비상,World
미  제재에 미사일 공습까지 중동 확전 우려 고조,World
미 대선  낙태 이슈  왜 중요    로 대 웨이드  판결 뭐길래,World
  연구팀  항우울제 단번에 끊으면 금단증상 온다 ,World
트럼프  새대가리  헤일리 저격 수위 높이며 투표 독려,World
 여왕됐으면 좋겠다    열광한  꽃무늬  여대생 근황 김유민의 돋보기 ,World
 트럼프 당선되면   반도체   서 다시 위기 ,World
중국 신장 규모     강진 발생,World
  개국 선거  포퓰리즘 공습    지구촌  폴리코노미 혼돈  속으로                ,World
 미스 일본  우승 우크라 출신 귀화인  갑론을박 ,World
미국 영국   상선 공격  후티 미사일기지 겨냥 추가 공습,World
트럼프 대세론에 부통령 후보군  눈도장  유세장서 지지 연설  뉴햄프셔 경선     ,World
중국 신장 위구르서 규모   지진  우즈베크까지 진동 ,World
 미 해군 네이비씰  명 이란무기 압수작전 중 사망    바이든발표,World
코커스   당원  프라이머리   일반인도 참여    곳 경선 슈퍼화요일  주목   문  답 ,World
  살인한파에 전역서 최소   명 사망 곳곳서 휴교와 수도 동파 피해,World
  윈난성 산사태   명 매몰   북극한파에 사망자 속출,World
   성형 수술      명당    건   전 세계  위 ,World
 분명 아일랜드행 비행기 탔는데  폭풍 피하다 독일에 착륙한 항공기,World
중국 신장자치구서 규모   지진 인도 우즈벡도 진동 감지,World
유럽 겨울 폭풍에 비행기 잇따라 회항  미국  북극한파 가고 홍수 비상,World
    연봉  직원보다   배 많으면 세금 더 내라  억만장자 저격한 샌더스,World
만델라 유품   점 경매에 남아공 반발 경매업체 해명 들어보니,World
    예멘 후티에  차 합동공습 지하시설 미사일  곳 표적 종합 ,World
 러시아 연료단지 회복 수 주 걸린다  나프타 정제마진 상승세,World
 알맹이는 일본인 그 자체    미인대회  등은 귀화여성,World
 미스일본 된 귀화 우크라 여성에  시끌   살때부터 살았다 ,World
 다시  금  사야하나       올해     오른다 ,World
 이스라엘  하마스에  인질 전원 석방  개월 교전 중단  제안 ,World
미 영  예멘 후티반군 미사일기지 추가 공습  토마호크 쐈다   영상 ,World
맥 못 추는 비트코인 현물        상장 후     넘게 하락,World
 자막뉴스    년이나 걸렸는데 순식간에   일본의 몰락,World
미 다우지수       선 돌파        도 연일 최고치 경신,World
미 공화 정치인들 트럼프에  눈도장  행렬 뉴햄프셔 경선    ,World
 하마스 돈줄  알고 보니  이란에서 수백억 암호화폐로 전달 ,World
   올해 대만 침공보다 봉쇄 가능성    개입 없이    개월 버틸듯 ,World
비트코인  한 때  만 달러 붕괴 현물    승인 후     ,World
 광범위한 재앙 가능성  중국 신장자치구서  규모      강진 발생,World
 대만    지원 없으면  개월 버텨 ,World
바이든 수낵  홍해 안보 논의 미 영연합군은 후티 공습,World
비트코인    상장했는데 가격  뚝  장중  만달러 아래로,World
미국 주도 연합군  후티 반군시설에 두번째 대규모 공습,World
아랍  개국  가자지구 평화 중재안 구체화,World
흔들거리며 착륙하려다 포기 겨울 폭풍에   국내선이 파리로,World
미증시는 연일 사상 최고    중증시는   년래 최저,World
미 영  예멘 후티반군 미사일기지 추가 공습,World
  통신  미 영  예멘 후티반군 미사일기지 겨냥 추가 공습 ,World
기세 오른 트럼프   미 대선 풍향계  뉴햄프셔에서 끝낼까,World
헤일리   김정은과 친분  과시한 트럼프 겨냥 광고 공개,World
젊은이들의 한탄    중국에서 유행하는  특공대식 여행        신년 글로벌리포트   세계 장바구니 물가 ,World
애플     헤드셋  비전 프로  판매 호조에 시총  위 복귀 종합 ,World
트럼프 독주    헤일리 반등 뉴햄프셔 경선서 판가름,World
   기대감에 다우존스 첫  만    선 돌파 다우        데일리국제금융시장 ,World
 중도 텃밭 뉴햄프셔  대반전 노리는 헤일리 쐐기 자신하는 트럼프,World
 한 달에  일만 집에 가요  차박 싫은 직원들 몰리는 회사  정영효의 일본산업 분석 ,World
오스카 수상  밤의 열기속에서  감독 노먼 주이슨      별세,World
우크라  러 에너지시설 공격에 국제유가    ,World
 미 영  예멘 후티반군 미사일기지 겨냥 추가 공습 ,World
